created_at;full_text_processed;label
03/08/2024;israel anything but democratic it a settler colonial apartheid state and everyone claims otherwise should go back to school israel the problem in the middle east erase the red dot;0
01/05/2024;palestine israel conflict concerns about per thousand of humanity that may demo fully fixed on it completely reality reason replacement nationalism and hatred of only jew state for freed world society without nation anti semitism and racism b;0
06/04/2025;funny i used to hate candace but her return to reality and the way her humanity shows in the face of israel slaughtering babies children and mothers daily she become watchable to me life strange like that;0
08/10/2023;israel just another random state in the middle east it a rogue state an international hub of criminals a master of subversion sabotage and manipulating western politics its end would nothing but a blessing for the west;0
03/11/2023;the palstinsi on the other hand the luxury of escaping the edges full of soldiers ready to kill them and the only airport they destroyed in and then by guess the isralians;0
26/06/2024;revive the boycott movement in the early years of al nakba the arab leagues boycott pressured the us to limit arms supply to israel its time to reinvigorate a comprehensive global boycott and hold these financial institutions accountable;0
22/06/2024;june marked the commencement of the th session of the human rights council the same un experts monitoring israel brutal occupation and genocide in gaza now looking into the human rights violations of us college students for protesting that genocide we will;0
14/12/2023;the letters on the table israel want the solution of two states he wants one of his from the river to the sea with the land of palestine but without its population;0
13/05/2024;jonathan free free palestine sumayyah over palestinians killed by israel say free free palestine;0
12/05/2024;demands from the duke students flyer we call on duke to disclose its financial investments in israel divest from companies profiting from the occupation of palestine boycott academic partnerships with israeli universities and speak in favor of an immediate ceasefire;0
07/10/2023;i reading and talking to those live in the region the palestinians attacked israel in a cowardly manner shot the elderly at the bus points entered homes and shot families hijacked elderly vilified corpses and now advertising barbarie that;0
15/10/2023;war criminals the israeli army ordered million palestinians to leave their homes and then killed many of them while trying to follow that impossible order;0
06/04/2025;nothing scares israel more than the camera and the truth since the ceasefire they ramped up their targeting of journalists and today the targeting of a tent where journalists gather near the nasser hospital;0
08/08/2024;israel torture and kills the palestinian prisoners israel kills the palestinian children israel bombarda hospitals schools and universities and humanitarian offices israel wants the extinction of the palestinians israel a terrorist state supports them an accomplice sionismonovonazismismo;0
04/01/2024;israel practicing a genocide in palestine since october and the daesh revives in the area attacking iran one expected less from mosad;0
08/11/2024;but you silently mute the only two state solution with palestine and palestine we joke a genocidal messianic regime must exist israelis people must learn equality and respect for human life those;0
20/11/2023;palestine the support of the world behind it it shall never crumble;0
15/11/2023;in response israel determined to end all the palestinians and occupy their territory to finally fulfill the zionist dream from the river to the sea better tell it well;0
28/05/2024;all eyes on rafah;0
06/04/2025;rafah existed for over years it wiped off the map by a settlercolony that existed for just years;0
01/06/2024;revolt for rafah join palestinian students supported by the wider community at columbia at a the new gaza solidarity encampment we outraged by columbia complicity in the killing of our people in gaza and most recently the massacre in rafah we equally outraged;0
26/05/2024;all eyes on rafah;0
28/05/2024;all out for rafah;0
06/04/2025;forgive me mum i swear i only accepted this path to help people lord accept my repentance these the final words of palestinian paramedic refaat radwan before he executed by israeli forces in rafah along with colleagues gaza;0
06/04/2025;rafah still exists;0
06/04/2025;a fine line separates and nothingness rafah it more fades before annihilation israel justifies its genocide through the defense of of abstraction the politics of bearing witness must begin with living palestinians live their lives precious;0
06/04/2025;queues of food and aid trucks abandoned on the egyptian side of rafah israel imposed a total blockade on gaza for over a month;0
06/04/2025;the rafah city and governorate exist anymore rafah completely erased and destroyed israel destroyed over of homes and leveled more than buildings and over housing units it wiped out of water wells and disabled most of the water;0
07/05/2024;all out for rafahthe people of gaza already displaced and forced into rafah backed into a corner there never a more critical time to throw pure right against the war machine all out for rafah escalate the student intifada;0
30/05/2024;guys look at mom you cant use all eyes on rafah so discreenshot btw dont stop talking about palestne;0
30/05/2024;guys mending kalian semua banjirin instagram nya pake all eyes on rafah all eyes on rafah all eyes on rafah all eyes on rafah all eyes on rafah all eyes on rafah all eyes on rafah all eyes on rafah all eyes on rafah all eyes on rafah all eyes on rafah;0
06/04/2025;protest program by jatiyatabadi chhatra dal against israel brutal genocide in gaza and rafah expressing solidarity with the martyrs and the injured in palestine and supporting the global campaign the world stops for gaza on april april at;0
04/05/2024;gaza the compass of our struggle and rafah the north star of the student movement all that we on campus we for the people of palestine we will stop full divestment we will stop palestine free;0
10/03/2024;all eyes on rafah last month israel threatened a ground invasion of rafah by ramadan this week netanyahu renewed his vow to invade rafah ramadan quickly approaching and a ground invasion of rafah looming we must escalate pressure;0
09/05/2024;fearless for rafah;0
06/04/2025;just like the mistake of burning people alive in rafah the mistake of slaughtering international aid workers from world central kitchen the mistake of gunning down starving civilians sprinting toward food at aid trucks the mistake of executing;0
05/03/2025;you insult me i pointed out that you dont know israel controls imports from rafah;0
02/04/2025;israel controls all imports and passes the rafah border part of the deal if you even bothered to spend mins reading the rafah wiki know that else dont you know;0
14/02/2025;if you just googled the rafah border crossing youd know that israel control over goes in and out;0
19/03/2025;you clearly never to the rafah border before i israel controls it;0
06/04/2025;we urgently appeal to the international community united nations agencies and all humanitarian organizations to assume their legal and moral responsibilities we also demand immediate action to pressure the occupying army to withdraw from rafah governorate to enable the;0
06/04/2025;months ago keir starmer said the rafah offensive should take place israel destroyed rafah and only starmers government take action against the israeli regime they continued supporting arming and assisting it;0
06/04/2025;there once a city called rafah this a war this genocide gazagenocide;0
11/03/2025;wall google the blockade of gaza and educate its crazy that you think egypt controls the rafah crossing when israel the one approves imports and exports from rafah how you know that;0
05/03/2025;if you even knew the basics of the situation youd know that the rafah crossing controlled by israel egypt part of the deal;0
24/03/2025;strange that you dont know rafah controlled by israel part of the deal its literally on the wikipedia page first paragraph else you know;0
06/04/2025;my grandmother born in rafah her sister worked in alshifa hospital their health going downhill since the ground invasion of gaza i cant quite imagine how that feels for them alshifa now little more than a charred building and a mass grave all of gaza;0
06/05/2024;nyc urgent call for mobilization citywide day of rage in defense of rafah take to the streets to resist the invasion monday may th hunter college th st amp;0
19/03/2025;you lying israel controls goes through the rafah crossing and there right of return;0
23/10/2024;you think egypt controls the rafah crossing google it youll see that israel controls it part of a deal in besides why should egypt take refugees why just let them live outside;0
30/05/2024;all eyes on rafah all eyes on rafah all eyes on rafah all eyes on rafah all eyes on rafah all eyes on rafah rafahunderattack gazagenocide alleyesonraffah;0
08/05/2024;we need to willing to risk everything for rafah;0
30/05/2024;all eyes on rafah all eyes on rafah all eyes on rafah all eyes on rafah all eyes on rafah all eyes on rafah all eyes on rafah all eyes on rafah all eyes on rafah all eyes on rafah all eyes on rafah all eyes on rafah rafahunderattack cont;0
06/04/2025;israel around longer than rafah rafah history goes back over years to around bce while modern israel founded in making it years old for the hostages taken by hamas in october;0
06/04/2025;hey post some issues rafah over years old true but it wiped off the map it damaged from recent conflicts yet still stands with people living there calling israel a settlercolony i;0
06/04/2025;deir albalah one of the least destroyed cities in gaza and home to a massive percentage of the displaced population i fear their intent to raise it like rafah this you voted to continue when you voted on the arms embargo last week;0
02/04/2025;yes israel control the rafah crossing google it idiot;0
06/04/2025;it take to bury a child beneath rubble and still call it justice her name alia she she died in rafah crushed under her home while holding her baby brother since october over palestinians confirmed killed but when you include the;0
06/04/2025;israel wiped the city of rafah off the map over yrs old first recorded mention of it in bce rafah a population of and recently february million palestinians sheltering there the world nothing;0
06/04/2025;will anyone face justice for the rafah ambulance convoy attack;0
06/04/2025;the red line around rafah will go down in history one of tge great deceptions and crimes of the century all i know that while it lost it will stand again;0
06/04/2025;rafah fallen northern gaza lies in ruins and the world grown numb to the cries once vibrant now shattered and yet the silence of the world deafening;0
06/04/2025;journalists this a substantial change israel just claimed rafah part of its buffer zone please compare the buffer zone white to this displacement order from march;0
06/04/2025;rafah wiped off the map by israels ethnic cleansing campaign;0
02/04/2025;how anything that passes through the rafah border approved by israel since;0
06/04/2025;after wiping rafah they now seek to mirror that in deir albalah;0
06/04/2025;israel changes story on rafah medic killings says will probe;0
06/04/2025;deir albalah about to look like rafah some will say absurdly and hatefully that hamas to blame please spare me israel going to this throughout gaza whether palestinians fight back or the last months and years made that abundantly clear;0
11/05/2024;popular university for gaza dispatch images from rafah and across occupied palestine flood our screens with fresh horror mangled babies bodies crushed under concrete some vaporized by usmade bombs;0
08/05/2024;tonight students and community members across turtle island holding the line and defending their encampments from riot police encampments need strong numbers and community support from pmam when raids more likely to take place all out for rafah;0
06/04/2025;contact immediately if you can help provide a tent for a family of in rafah;0
06/04/2025;happened to the medics in rafah an isolated incident it part of a systematic targeting of prcs staff and volunteers in the gaza strip;0
06/04/2025;rafah genocide joe red line it just declared wiped off the map by israel none of trump in palestine would possible without joe and kamala unwavering support and complicity different colors same monster;0
01/04/2025;the rafah border closed and the red cross confirmed it cannot even get cancer patients out you lying and we can all see it;0
06/04/2025;truly fuck egypt wow israel trying to negotiate in good faith to open rafah to let out gazans that want to leave and egypt responds by putting up concrete barriers;0
06/04/2025;director of medical supply at the civil defense in gaza we any ambulances in rafah and the central region we cannot find water to fill firefighting vehicles;0
06/04/2025;whats wrong whats the reason the egyptian army closing the gates of the rafah crossing on the egyptian side with a tall concrete wall for the time;0
06/04/2025;we hear you hind and we see theyre israel trying to erase the southern gaza strip like they trying to erase the north also further isolating gaza from egypt and the rafah crossing read more below;0
08/05/2024;more importantly students should understand that getting suspended for escalating for rafah a honorable b nothing in comparison to the experience of students in gaza where the iof destroyed every single university;0
06/04/2025;they bombing rafah with new terrifying missiles and we in khan yunis terrified by their sound scary thoughts come to our minds about if we next please i ask the world to stop this genocide we human beings;0
06/04/2025;let bangladesh stand still tomorrow in gs sorrow at gs call;0
14/01/2025;there journalists and journalists the first with a capital g those let intimidated by the sionist threats and intimidations in report there eyes from gaza;0
09/04/2024;todays mainichi shimbun an article in citizens showing their wills around the country in opposition to the ethnic cleansing of gaza a reporter contacted me that all the notations that once turned into battle converted to invasion of gaza each persons position changes one step at a time lets stop it;0
06/04/2025;gaza globalstrikeforgaza noone can erase g matter israhell remember this gaza alive gaza will alive gaza will free our palestine will free inshaallah inshaallah inshaallah;0
06/04/2025;gz the great;0
29/10/2023;journalists in gaza call for a prayer for the resistance fighting the invaders;0
06/04/2025;please keep supporting the and efforts to to get our brothers and sisters in g water the need so so incredibly great please keep sharing and donating they need us;0
06/04/2025;wtf israel just fucking lvel gza;0
06/04/2025;gza rafah empty there one alive;0
06/04/2025;pakistan a nuclear power yet it couldnt provide to plestine egypt nile river but gza died of thirst saudi arabia and uae oceans of oil but gza hospitals and ambulances fuel muslims soilders missiles fighter jets yet none of it could reach gza;0
06/04/2025;last update need of food in ganja oxygen needed media personnel around the world banned from entering gja aljajera cnn nbc give ultimatum to all journalists to leave gza by idf israel defence force;0
06/04/2025;the foot stinks amp;0
06/04/2025;hey you support whatever happening in g a za;0
28/08/2024;finding the opportunity in the impossibility a doctor in gaza tried to save a childs life with a telephone light;0
06/03/2024;there a genocide in gaza for days thousand children and thousand women crime trying to their job only journalists detached from life forget thousand innocent people killed in days gzt video editor prepared;0
14/12/2023;activists gathered to organize a support for palestine in australia protested zara made fun of the civilians massacred by israel in gaza;0
06/04/2025;it will remembered muslims over million soldiers heavy artllery mssiles fghter jets but none of it could reach gza to provide aid palestineunderattack;0
29/08/2024;every street where beautiful memories pass every street returned to a pile of debris every street;0
18/11/2023;the persecution in palestine decreased or it trying to make us feel like that gzt editor in chief tells zionistcensorship;0
10/12/2023;why zara made fun of the palestinians with the visuals he shared innocent brand days;0
18/11/2023;how it affect us to witness happened in gaza zionistcensorship;0
28/08/2024;finding the opportunity in the impossibility a doctor in gaza tried to save a childs life with a telephone light;0
18/08/2024;children in gaza a nightmare with death fear and hunger for months;0
23/03/2024;humanitarian aid delivered for the third time to the north of gaza;0
04/05/2024;the second one of this month completed the reinforced hg zz fully armored with additional weapons from the old fa zz kit;0
14/11/2023;hundreds of civilians took refuge in gaza to entertain children at the school held a football match;0
11/03/2025;stogragta i complained to nazupi sings a zuzu gag gacha and refuted zuzu shocked by the police interested in mayoral elections zuzuflower breed nazunahorse manhawk tigerstogra gbc stogra clip;0
06/04/2025;this a war its a gencide in a war you trying to inflict a military defeat on the enemy army in a gencide youre trying to exterminate the civilian population;0
05/04/2025;you call it when you surround a hospital amp;0
01/04/2025;very good partners in crime in gencide in ethnic cleansing belgian mep reprimanded the eu high representative for foreign affairs amp;0
02/04/2025;one gencidal statement after another rael if you look at they write in their newspapers they say on public affairs radio amp;0
05/04/2025;you call it when you surround a hospital and bomb it when you line up doctors physicians nurses amp;0
05/04/2025;tonight in jerusalem protestors against the gencide chanting refuse to war criminals dont bmb children calling for soldiers to refuse service in the israeli military;0
06/04/2025;this a war its a gencide in a war you trying to inflict a military defeat on the enemy army in a gencide youre trying to exterminate the civilian population gazaholocaust;0
04/04/2025;very obviously girl the gencide and still;0
01/04/2025;when the extermination of healers eclipses history darkest gencides humanity confronts its moral bankruptcy gaza decimation of healthcare workers gencide by arithmetic this week iof executed blindfolded ziptied healthcare workers from in gaza;0
04/04/2025;i could make u a whole list with reasons why but the most important that gencide wrong;0
29/03/2025;the real villain of empuraan baba bajrangi abhimanyu singh appears inspired by babubhai patel aka babu bajrangi a bajrang dal leader convicted for his role in the naroda patiya mssacre during gujarat gencide where muslims killed gujaratriots mohanlal;0
29/03/2025;idgaf if youre jewish or of israeli descent just dont proisrael government i may completely educated on the gencide but ive seen too many children and people in general getting brutally killed and sad to pro palestine free palestine zionists dni;0
04/04/2025;a british citizen from manchester in gaza indiscriminately firing on civilian homes and comitting gencide why these terrorists allowed to commit gencide and freely return home to the uk us europe without their citizenships revoked;0
28/03/2025;its fucking traumatizing when you social anxiety and you speak up up for palestinians on sns and some random men just shows up throwing bricks at you for against war and gencide theyre literally crazy;0
28/03/2025;they the backing of the trump regime so the gencide full on now camps coming;0
04/04/2025;haunted witch once again banned for gencide apologia l bozo april th;0
04/04/2025;hasan piker a champion for human rights and indigenous people unless its uyghurs then him amp;0
23/03/2025;isrl shouldnt even exist and talking about it an actual statecountry part of znizm the gencide will end when the occupation;0
26/03/2025;wtfdym forced he literally gave money to a terrrist state to commit a gencide and ethnic cleansing;0
20/03/2025;this me trying my best to survive a gencide facing it all with a smile even though i very hungry and i ashamed of saying it i trying my best to afford something for my family it getting worse please donate if you can;0
26/03/2025;or to fund gencide against people in tents;0
02/04/2025;one gencidal statement after another rael if you look at they write in their newspapers they say on public affairs radio amp;0
06/04/2025;gaza called for a worldwide strike next monday april it our duty to follow it there will schools universities work the gencide stops;0
05/04/2025;israel commiting a gencide and its very evident wtf;0
27/03/2025;the somewhat ironic reality about the situation in occupied p that those least likely to support their brothers and sisters the ones with the most power influence and ability to end the gencide many individuals particularly the ulam avoid discussing;0
01/04/2025;when the gencide in gaza over when it politically safe but far too late the and other mainstream media outlets will finally report basic truths sadly and shamefully this follows a longestablished pattern;0
06/04/2025;that we need to shame zionists and gencide supporters;0
06/04/2025;msm complicit in this gencide the politicians provided arms to the brutal regime;0
05/04/2025;i aint brining a child into a word where gencide normalized pds amp;0
04/04/2025;i truly can understand how the world allows this to continue how much longer must palestinians endure such suffering and pain before the world something we witnessing a gencide in real time yet we unable to anything to stop it;0
02/04/2025;you need to correct this quote they in the least hiding the fact that theyre committing gencide;0
04/04/2025;antiisrael agitators mass outside ritchie torres office demand he resign for collaboration in gaza gencide one protester outside torres office denounced the lawmaker zionist scum amp;0
06/04/2025;protesting gencide easy buy products that finance murderers and their supporters boycat app;0
05/04/2025;amazing courage to that in izrail where of the population just fine with gencide in g_z;0
20/03/2025;this me trying my best to survive a gencide facing it all with a smile even though i very hungry and i ashamed of saying it i trying my best to afford something for my family it getting worse please donate if you can;0
06/04/2025;jihad against isrel now fardh for every muslim;0
06/04/2025;israhell a criminal entity;0
06/04/2025;fuck israhell;0
06/04/2025;continue boycotting israhell;0
06/04/2025;fuck israel israhell;0
06/04/2025;if there nothing to hide why the totalitarian approach we all know isr a criminal gangster state;0
12/02/2025;israel a jewish terrorist state israel a jewish terrorist state israel a jewish terrorist state israel a jewish terrorist state israel a jewish terrorist state israel a jewish terrorist state;0
06/04/2025;realities uncovered nothing casual think badly and youd damn right today tomorrow amp;0
06/04/2025;in gaza people still attacked by that country on march over people killed in the attacks and jh one of those helped isr in killing innocent children and women shame on him;0
06/04/2025;isr terrrist organisation;0
06/04/2025;agree why zionism created in the first place ie to destroy ottoman invade amp;0
06/04/2025;israhell a terrorist state you murdering scumbags killing innocent children you sick in head i hope you all go to hell;0
06/04/2025;nons for everyone except israhell;0
16/07/2024;isarel a country full of hidden superheroes where one cannot know each one but we find people in normal appearance that when he sees that the country danger;0
06/04/2025;never ever isrel will always our enemy genocidalists cannot our friends;0
06/04/2025;please so all nations should come together to wipe out israhell;0
06/04/2025;stop arming israhell now;0
06/04/2025;it ironic that the zionests nuclear power of israhell will the very single weapon for the end of this fake parasite entity forever;0
21/09/2024;to all those question israels right to exist allow me to say one thing to you;0
06/04/2025;get men pregnant;0
06/04/2025;only hindutva harramis find joy in genocide of palestinians by israhell palestne gazagenocide gaza;0
06/04/2025;for those jokers saying muslim armies cannot wage jihad against isr there a fatwa from the top ulama council let see how many islamic armies announce jihad against the filth zinist state;0
06/04/2025;why isrel use words like yalla and ya rab this astounishes me;0
06/04/2025;american soldiers will dying for isr;0
03/01/2025;ladies and gentlemen i present to you the zraelis;0
09/02/2025;every last hostage home;0
06/04/2025;jhad against isrel fardh upon every muslim man;0
06/04/2025;i feel so so sorry for these young men going to die for their country trump sending them for israhell there glory in this at all they will massacred;0
15/02/2025;israel a terrorist state israel a terrorist state israel a terrorist state israel a terrorist state israel a terrorist state;0
06/04/2025;usa killing kids and women in yemen israhell killing kids and women in gaza cowardice this two war criminals allies favorite target vulnerable civilians;0
06/04/2025;that the goal collateral damage the goal to kill maim displace traumatize palestinian children targeting children and women kills the future and thats israhell and its allies want;0
06/04/2025;isr amp;0
22/02/2025;this image more joyful than the nasrals and newbarer;0
