created_at;full_text_processed;label
06/04/2025;if anybody needs a chip inserted in their brain named fafo satanyahuhu trump should order elon to implant one with delays in his sick mind so the gaza killing stops;0
06/04/2025;i just pledged my support to for justice dignity and peace in gaza join me in standing with the people of palestine to help them rebuild their lives and futures add voice today standwithgaza justiceforgaza;0
06/04/2025;taking a position on gaza taking a position on gaza one you to live with for the rest of life;0
06/04/2025;the children of gaza stand proof of a world that looked away dont look away;0
06/04/2025;i just donated to a family in gaza struggling to survive the war every little bit helps them get food and water please consider helping too share and donate if you can one love free free palestine free free gaza lt;0
06/04/2025;ousman noor instructions how to stop gaza genocide weve launched a campaign to estbalish an international armed force to stop the gaza genocide we instagram;0
06/04/2025;reminder to if i feel life hard please remember there people in gaza suffering more than me i still stand today god mercy my power or resilience i weak and that me i human;0
20/01/2025;suspension for gaza the highest honor repost from on instagram;0
06/04/2025;please dont stop talking about gaza;0
06/04/2025;salute to the courage of this lady for expressing in this big forum at microsoft israeliwarcrimes gaza gazaholocaust;0
06/04/2025;the idf crimes against humanity stoptradewithsettlements endisraeliimpunity sanctionisrael aparthiedisrael israelinewnazism stoparmingisrael israelterroriststate endzionism stoparmingisraelnow unseatisrael freepalestine gaza gazagenocide gazaholocaust;0
06/04/2025;stop the holocaust in gaza;0
06/04/2025;stop the world for gaza;0
06/04/2025;help obadas family escape from gaza war and reclaim their lives please support this gofundme by donating or sharing every bit of help makes a difference;0
06/04/2025;i able to match the last for new campaign can anyone else the same he to leave his family behind in gaza when he finally got the chance of medical evacuation for his own severe injuries please help him to make sure theyre provided for;0
06/04/2025;morocco rabat for a freepalestine and stop gaza genocide;0
06/04/2025;all they lie the palestinian info center half a million followers on facebook posted a photo of actress katherine heigl played dr izzie stevens in grey anatomy identifying her a french doctor traveled to gaza to offer medical help;0
06/04/2025;america already directly responsible for genocide in gaza if we combat troops on the ground there our nation crossed the rubicon;0
06/04/2025;stop the genocide_in_gaza please;0
06/04/2025;qaza palestine gaza the city of resilience and patince;0
06/04/2025;please help oday and his family by donating and sharing;0
06/04/2025;this the prominent leader targeted by american aircraft the martyr sarim ibn sheikh saleh alsuhaili one of the martyrs of the american aggression on their home in the saawan area of sanaa the children of yemen less important than the children of gaza _;0
06/04/2025;people idea how tiny of a strip gaza amp;0
04/04/2025;i think the issue with indians their ignorance for instance most think that kashmir horrific where around children died but dont think gaza a genocide where children killed and where;0
06/04/2025;kids in gaza asking for justice they asking for water for light for a night without drones overhead if that haunt you you paying attention;0
06/04/2025;we dont water to drink we need support to provide water for us campaign received support at all for the last two days please help her and her three young children;0
20/01/2025;from on ig last week columbia held disciplinary hearings against alleged student protestors from the gaza solidarity encampment during their hearings students spoke bravely about their commitment to fighting towards a free palestine and forced the university;0
06/04/2025;the world failed gaza palestine we will never forgive never forget if someone says one bad thing about hitler after all of this he just should act earlier maybe there a chance with all respect to normal jews zionists humans animals they hell on earth;0
07/12/2024;but the fight far from over the humanitarian crisis in gaza worsens ulc must actively work to incorporate the palestinian perspective into its programs and partnerships the school of public health cannot claim to stand for equity and social justice without addressing the;0
18/03/2025;after two weeks of a brutal siege denied palestinians lifesaving humanitarian aid and drone strikes that killed dozens the israeli occupation forces renewed their escalated bombardment of gaza and announced a total collapse of the ceasefire alleyesongaza;0
06/04/2025;powerful show of force to the warmongers and billionaires that the people will intimidated and that we will remain on the streets in defense of the palestinian people and our collective humanity free palestine end the usbacked israeli genocide in gaza;0
06/04/2025;notice how the racist chabad princess makes sure to use the photo that associates khalil gaza with the supposedly deranged libtard but the most retarded part thinking means to kill lol;0
15/01/2025;we the student movement for palestinian liberation commit to the fight ahead we will rest we achieve divestment secure an arms embargo and end the siege on gaza;0
06/04/2025;there a journalist burning on fucking live feed in gaza right now and of course this supposed to normal;0
06/04/2025;those in gaza directly bombed by israel starved to death israel prevents humanitarian aid to get through;0
07/10/2024;the american university in cairo today a year into the genocide in gaza auc students climbed to the rooftop of the sse building during assembly hour to raise two banners so all campus could see the st banner reads one year of genocide the nd reads today its;0
06/04/2025;free phalastina free gaza;0
21/11/2024;all out to sarah lawrence college defend the student intifada for over days our institutions ignored the genocide of our people in gaza we demand that they disclose their financial investments and they divest from death rally to demand disclosure divestment;0
06/04/2025;undersecretary of the ministry of health in gaza during the war deaths among children recorded due to malnutrition and we facing new numbers unless food supplies allowed in;0
06/04/2025;international calls for a global strike on monday april in solidarity with gaza and in rejection of the ongoing israeli massacres against palestinians;0
06/04/2025;israel committing genocide in gaza;0
31/12/2024;while the us empire and the zionist entity increased their aggression against our families and loved ones in gaza and across the region the student movement across the world stood up and fought back against their institutions complicity in genocide;0
15/11/2024;tufts bent to the zionist donors of this school but its students will we asking the students of this university to hear the cry of gaza and recommit for the fight towards divestment together we will help create a free palestine within our lifetimes;0
12/03/2025;while the us ramps up its militaristic repression at home it enabling the zionist entity in cutting off electricity to gaza this mahmoud protesting against american fascism and zionism go hand in hand;0
06/04/2025;when massacre of muslims taking place in gaza im horrifying to read muslim priorities other then this on social media please voice for this unlawful killings in gazza;0
06/04/2025;stop talking about gaza;0
04/04/2025;the footage from gaza several order of magnitude worse than the footage of the holocaust vietnam and even dresden combined;0
06/04/2025;i might the next martyr this our reality this the voice of gaza how long will this nightmare last;0
19/01/2025;the ceasefire begins we honor the incredible resilience and sacrifice of the people of gaza let continue to support mutual aid efforts and organize to eradicate zionism on our campuses our work only just begun;0
14/10/2023;between jakartas poor air quality my allergies and continuous horrific updates about war crime in gaza i didnt get much sleep last night other than praying donating and amplifying the underreported ground truth else can we palestinegenocide;0
06/04/2025;shout out to karachi merchants striking for gaza while we host netanyahu in washington;0
06/04/2025;sadly they cannot trust anyone in gaza so i blame them for rather safe than sorry situation;0
25/01/2025;of gazas schools destroyed youth already deprived of years of education due to covid and war now face a drop in future earnings this just an attack on education it an attack on an entire generation future;0
06/04/2025;theyve made gaza a death trap both physically and mentally;0
06/04/2025;this the world we created it all a part of the same phenomenon western governments actively assisting genocide in gaza;0
13/03/2025;for the past days and during the holy month of ramadan israel refused to allow the entry to any humanitarian aid into gaza at the same time zionist attempts to ethnically cleanse the west bank intensified this month and every month we will continue to show out;0
06/04/2025;the news from gaza utterly horrific from the west bank too and from lebanon the over militarisation of any country leads inevitably to invasions and then to world conflict this those support the above want that you voted for in the uk and us;0
05/04/2025;there war going on in gaza;0
06/04/2025;stop bombing gaza stop targeting journalists;0
06/04/2025;israel leveled gaza then killed the drone journalists showed it to the world only drones can begin to capture the scale of destruction in the gaza strip the journalists it targeted again and again;0
06/04/2025;the guardian provides a full account of diabolical war crime israeli military changes account of gaza paramedics killing after video of attack;0
18/03/2025;the genocide never ended and we will never silenced we continue to stand with our brothers and sisters in gaza in the face of this continued onslaught alleyesongaza gazaunderattack;0
06/04/2025;dupes manipulated by the muslim brotherhood captured on video everyone of our cops should spend time with the idf in gaza to learn how these terrorrists roll frigging ridiculuous;0
01/01/2025;healthcare workers and students we a moral imperative to use all available resources and channels to ensure the safety and protection of healthcare workers in gaza particularly dr abu safiya whose life and work in immediate danger;0
06/04/2025;why churches in gaza tons of crosses and palestinian christians problem wtf you talking about;0
06/04/2025;even the idf claims that you lie;0
04/11/2023;u can simple pray dont stop talking about this genocide braw;0
06/04/2025;dear world it the rwanda genocide it the genocide against the tutsi words matter truth matters please get it right and help us protect the memory and dignity of the victims kwibuka saytherightname;0
06/04/2025;i from malaysia along with my uyghur brothers boycott shein temu chinese products and any products that support genocide and slavery against uyghur muslims boycott american products owned by zionist jeews good but dont forget to boycott chinese products;0
24/11/2024;genocide pelosi you blood on hands us and sf state students say aipacfunded award ceremony for nancy pelosi on november st and part of the international call to action usfca sjp and sfsu gups held a picket line at the hyatt regency in protest of usfca;0
06/04/2025;genocide the industry of israel;0
06/04/2025;hats off to the most courageous engineer ibtihalaboussad billgates_supports_genocide shame on you;0
06/04/2025;it anticatholic to hold the state of canada to account for its genocide of indigenous peoples and its antisemitic to hold the state of israel for the genocide of palestinians all states around the world must follow international human rights laws it doesnt;0
06/04/2025;i just signed a petition microsoft end complicity in apartheid and genocide sign here;0
06/04/2025;genocide gaza israel gazaholocaust idf stockmarketcrash bbtvi israelterroriststate this a human burned in front of the world the ones burned him the jews;0
06/04/2025;they spineless selfish greedy maggots afraid to stand up for auschwitz camp of gaza daily slaughter of civilians you also accomplice in this genocide may dreaming to enjoy the future riviera planned by the orange clown on the graves of palestinians shame on you;0
06/04/2025;x deleting progaza accounts muslims brutally killed before our eyes innocent kids with dreams amp;0
06/04/2025;download and to ensure that you purchasing items that complicit in israels genocide we we can with the choices that we we must keep ramping up our efforts boycott israel boycott those related to israel;0
07/11/2024;from jail support needed protestors arrested after palestinian students and community members disrupted genocide denier and notorious sellout yossef haddads event in chicago zionists and cpd getting aggressive mobilize to jail support now;0
04/04/2025;only sick individuals will focus on the victims of a genocide and ignore those committing it you a sick individual;0
06/04/2025;end this genocide;0
21/11/2024;tomorrow students lecturers professors and university staff members across the globe will refuse to attend classes or go to work we will bringing our institutions to a grinding halt the struggle against israels genocide of the palestinian people and against the states;0
06/04/2025;yo genocide bad but so she;0
06/04/2025;genocide clear day;0
06/04/2025;israel a terrorist entity committing genocide and apartheid with the support of usa uk europe and the coward arab leaders zionists barbaric and cant among the civilized nations of the world;0
03/04/2025;western university students more than the entire arab world combined to end the genocide except yemen of course;0
06/04/2025;yousef exhausted from this genocide food and water rare and very costly with help he can survive and his family too please donate to him and share;0
08/10/2024;the pro genocides dont any argument to justify why they support genocide instead of humanity amp;0
04/04/2025;muslims in india dont support the genocide though generally speaking;0
06/04/2025;in the near future it shouldnt surprise anyone if states take actions against people like this sowing discord and promoting the genocide of my people while a massive online following thats a national security threat;0
13/03/2025;we watch students across turtle island mobilize in response to mahmouds illegal detention we reminded of mahmoud detained for organizing against the genocide his people and for the liberation of his homeland;0
06/04/2025;stop genocide stop killing of innocent people of palistine oic wakes up when you wake up when they attack you a responsible muslim a good muslim;0
03/04/2025;all noise to distract from the genocide they committing;0
04/04/2025;very true dont you think he will more mercy for those that take action to stop the genocide opposed to those could done something but;0
28/10/2023;this a war it a crime against humanity this genocide we the voice of palestine now pray for them now free palestine freepalestine ceasefirenow;0
06/04/2025;criminal attack;0
06/04/2025;i vehemently oppose genocide apparently i antisemitic and an extremist it sounds crazy it crazy israelterroriststate;0
06/04/2025;they even work with israel its just useless to stop genocide its complicit in the murder and torture of palestinians shame shame on them shame on those follow them would you follow evil murderers amp;0
06/04/2025;just look at the devastation that russianbarbarians done in ukraine how long will leaders of the world allow this genocide to continue putinisawarcriminal magaaremorons;0
06/04/2025;true at the protest i at there a sea of free palestine flags keffiyehs and just about each speaker mentioned the genocide;0
04/04/2025;a zionist organizations cancelling someone nothing new wary of those pay memberships to these groups cover for genocide;0
06/04/2025;it so crazy to in happiness while also committing a genocide miles away;0
06/04/2025;israel inclusion a terrorist group unconventional it a state a nonstate actor like those i listed the genocide debate in gaza polarizing some like amnesty see evidence;0
06/04/2025;oh jfc russell rebrand you fucking embarrassing the only reason this extraordinary it absolute joseph goebbels machiavellilevel propaganda the us actively jailing disappearing and deporting people speak up against a usrael genocide and he;0
06/04/2025;nothing like nothing provokes me more than zionists thinking they ate after saying free palestine form hamas;0
06/04/2025;moral of the story israel reducing the number of children in gaza with the aim of preventing them from joining the resistance in the future this why they bomb them every day and we havent seen any hamas fighter killed in battles open eyes world its planned;0
05/04/2025;but israel specially kills palestinians hamas ages to exact;0
06/04/2025;a point well taken and believe it or i agree with you on that point instead of targeting hamas israel went indiscriminate just flattened everything that where they went terribly wrong and that got them hated world;0
06/04/2025;palestinians ruthlessly crucified of hamas but palestinians hamas there millions of innocent palestinians even interested in these stupid politics of war between israelis and hamas wh;0
06/04/2025;i bet idf killed him there hamas left in gaza its just idf and civilians mostly kids or he killed israels explosive removal teams cause they dont that trump gave them our guys for that task;0
07/05/2024;despite reports that hamas willing to accept a ceasefire deal the zionist entity presses forward with its bloodsoaked plot make mistake in their eyes this the final solution to the palestine question the zionist entity aims to wipe gaza off the face of the earth;0
06/04/2025;breaking hamas firing rockits at isralei gaza just fired rockets towards israel with one intention only to kill many israeli civilians they possibly can its days and gaza still rockets read that again;0
06/04/2025;and the bought off by islamist extremists hamas supporters and radical islamic jihadists in canada it highly suspicious that the federal government permitting these throngs to destroy jewish businesses and property shill against;0
30/07/2024;a little girl her once beautiful face disfigured by skin disease ravaging children due to pollution and the lack of medicines that the israeli occupation prevents from entering gaza;0
30/05/2024;all eyes on rafah mean rafah in crisis after days of suffering palestinians forced to flee their homes for makeshift tents in rafah promised a safe zone by israel but even there they face brutal attacks;0
29/11/2023;a recently launched app helps people identify products from israel allowing them to make informed choices and avoid supporting genocide;0
06/04/2025;fuck israel;0
06/04/2025;baby killers gazaholocaust;0
06/04/2025;fuck israel;0
01/11/2023;israel regard whatsoever with the lives of the native palestinian population on whose land land they occupy jabalia gaza;0
15/11/2023;in hebrew it says philisteenah that palestine;0
01/08/2024;israelpalestine sovereignty two state solution;0
11/01/2024;palest in gaza entitled to exist to situate the rights to existwhat happ in gaza entails a destructive act by an occup pwr that subjected the palest ppl for violations of self determination for a cent israel for years regarded above the law;0
09/01/2024;israel will destroyed jerusalem and gaza will free this the promise of allah you dont a doubt keep our feet and heart intact;0
02/01/2025;according to zraei officials they will rest they to the pestinians htler wanted to to the jews guess that makes them;0
04/09/2024;the message to sr very clear get out of p it country;0
06/04/2025;from the river to the sea israel will free from their existence;0
06/04/2025;ummah needs to deal with zionistss quickly for palestine with whatever power and tools available with you ignore coward and traitor leaders;0
14/10/2024;n sr burning p alive n germany put jews in gas chambers if sr bothered by called naz then they shouldnt act like n or even worse;0
06/04/2025;fuck israel x america;0
06/04/2025;the arc of justice bending towards the people of palestine;0
09/12/2024;israel ngeb bombs syria stop silent stop ignorant keep boycott;0
06/04/2025;expel the israeli ambassador boycott israel arms embargo to israel now call upon the and to act now justice delayed justice denied;0
01/05/2024;hey zionists its palestine israel an imaginary state;0
06/04/2025;the scale of terror israel inflicted beyond anything else in human history;0
03/12/2023;israel defense forces the worst you got the point dude;0
21/06/2024;the republic of armenia officially recgnizes palestine an independent state;0
26/06/2024;the ongoing bombardment of palestine intensifying daily bringing even more destruction and suffering citibanks partnership with israel plays a direct role in supporting the genocide in gaza;0
06/04/2025;it doesnt matter fucking israel killing peacekeepers amp;0
30/03/2025;rael interested in piece in peace a piece of palestine a piece of lebanon a piece of syria a piece of egypt a piece of jordan a piece of iraq a piece of saudi arabia;0
24/09/2024;students in light of israels recent attacks on the people of lebanon join and organize contingents for emergency mobilizations in locale we near one year of genocide on gaza we reminded that the united states will continue to allow israel to violate every norm;0
06/04/2025;peter dutton the worst thing that happened to australia how that racist bigot can a candidate a shame for australia;0
06/04/2025;this and the line where you will condemn and for the slaughter of these beautiful children or you still ok with unconditionally supporting israel voters would like to know it will take for you to finally place sanctions;0
06/04/2025;israel the devil if a devil exists jfc;0
18/01/2025;mass murderers pure and simple israel an abomination and pariah state of our time the zionist project proppedup by us uk and eu will never legitimate ever again unapologetic purveyors of genocide israel a political entity will never welcome again a;0
06/04/2025;buried alive with their feet bound israel the right to commit war crimes you still offering israel unconditional support gazagenocide warcrimes thehague;0
13/01/2025;this the sick sadistic state of israel it already beyond the pale;0
13/12/2024;repost from on ig divestment now permanent following our encampment protesting sf states complicty in israels genocide of the palestinian people sf state divested from lockheed martin caterpillar leonardo and palantir of today these wins will now become;0
06/04/2025;israel repeatedly attacked palestinian children and yet spews israeli propaganda to demonize to un relief for victims of israels decadeslong apartheid and genocide he lacks the moral compass to lead the nation and will prioritize israel before canada;0
06/04/2025;israel withholding humanitarian aid reality;0
13/11/2023;netanyahu continuing with the strategy that led israel to the abyss pushing the pa into a corner in order to shoot down any option for a twostate solution collaborating with settler parties and setting the region on fire haaretz editorial;0
06/04/2025;the list of israels lies just too numerous yet some people would still back israel even it intentionally murders children amp;0
06/04/2025;keep opening big mouth minutes time short youre mocking god those curse israel will cursed;0
06/04/2025;he doesnt find beheaded babies livestreamed everyday horrifying but he finds a flag horrifying tells you everything you need to know;0
06/04/2025;i think cultural boycotts of both israel and russia the right move here;0
06/04/2025;america such a lark when innocent americans murdered by some weird serial killer theyll deploy all resources to track the person down and stop them at the same time they and their partner in crime israel murder innocent people day in and day out joke of a country;0
02/11/2023;and everyone i know comes back disgusted with israel;0
06/04/2025;kind of a scum sadist it abuses a little girl like this answer an isisdaish scum sadist of the zionist socalled free syria;0
11/10/2023;the palestinian people hamas israel done against palestine forgiveness even the god they profess the extermination of a poor nation and looted in the st century without the ability to defend an unimaginable crime pajasineunderattack;0
10/04/2024;if youre honest youll admit that every single palestinian christian or otherwise lives in the state of israel there true autonomy for the ones in the west bank and gaza israel exterminating them;0
13/10/2023;local local pashtuns of waziristan pakistan promised to travel to palestine join jihad and fight the israeli forces they say they ready to sacrifice everything and need support or help from anyone but allah in addition;0
06/04/2025;palestinian foreign ministry condemns the death of omar rabea calling it an extrajudicial killing amid ongoing violence in the west bank;0
24/08/2024;more than a thousand palestinians support the concept of islamic isis like to cut the head of non islamic people and refusing to change to islam and will enforce the law of shariah i think you looking for a dead after a while we will see woke and the palestinians wave the isis flag;0
06/04/2025;israel intentionally targeted and bombed the journalists tent in khanyounis;0
13/05/2024;encampment at tu eindhoven students occupied a part of tue campus to demand that their university cut ties with israel join the students now bring tents sleeping material food and water follow eindhovenencampment on instagram for updates;0
06/04/2025;imagine a government liking you post online so they bomb house that israel to journalists for days straight and killed over journalists so far;0
