created_at;full_text_processed;label
03/11/2024;standing with israel the most moral choice anyone can ever take if you support israel feel free to comment i stand with israel;2
02/08/2024;we will always stand with israel even if the war expands to a comprehensive war israel defending and its existence against islamic terrorism;2
07/03/2025;this israel a tiny dot on the map and the only jewish state in the world attacked on multiple fronts by radical islam and terrorist groups surrounding us israel fighting for its entire existence standing with israel the right thing to;2
01/02/2025;if youre jewish or an ally comment below i stand with israel lets unite together on this platform;2
08/10/2023;puerta del sol madrid lit up in support of israel standwithisrael;2
12/10/2024;they might try to silence the truth but together we can ensure it heard every share every comment helps break the silence stand with me stand for the truth drop flag and show support istandwithisrael;2
21/10/2023;share if you support israel right to defend standwithisrael;2
20/11/2023;back to basics history cant rewritten the jewish people indisputably indigenous to the land of israel let facts speak louder than any doubt standwithisrael;2
21/03/2025;candace a christian you must know how god feels about israel he made a covenant with them amp jews his chosen ppl we r supposed to stand with isreal part of a covenant with god messianic jews believe christ the son of god;2
28/06/2024;israel and always the jewish peoples one and only true homeand that home now under attack standwithisrael israelunderattack;2
15/10/2023;israel and always the jewish peoples one and only true homeand that home now under dire threat standwithisrael israelunderattack hamasmassacre hamasisisis;2
24/12/2024;standing with israel gods will standing with israel upholds justice and truth standing with israel a stand against terrorism standing with israel means standing on the right side of history;2
17/10/2024;raise hand if you stand with israel;2
02/04/2025;isreal owned the land first god allowed foreign invaders in of their unbelief palestine the name enemies of isreal gave them to mock them it means philistines in latin isreal god people i will stand with them and i will pray they repent and turn back;2
14/09/2024;standing with israel gods will israel here to stay;2
23/09/2024;share if you support israels right to defend from terrorism;2
30/10/2023;israel only the right but the duty to defend and its citizens standwithisrael israelunderattack hamasmassacre hamasisisis freegazafromhamas;2
03/11/2023;a disturbing message in las vegas a stark reminder of rising antisemitism and the urgent need for unity against hate via gal adiv standwithisrael;2
07/10/2024;i stand with israel standwithisrael;2
27/11/2024;stand with israel for our people our land and our future together we defend freedom and unity share and comment with a flag to show support;2
13/01/2025;this israel a tiny dot on the map and the only jewish state in the world attacked on multiple fronts by radical islam and terrorist groups surrounding us israel fighting for its entire existence standing with israel the right thing to;2
21/11/2023;israel everything it can to protect innocent lives hamas everything it can to end them standwithisrael freegazafromhamas;2
09/10/2023;czech republic stands in solidarity with israel;2
16/11/2023;in these dark times remember israel alone standwithisrael;2
09/02/2024;when you stand with israel and against hamas you standing with democracy and against those forces that threaten to destroy it;2
01/02/2024;this israeli resilience embodied even in the midst of war a war that forced upon the people of israel by a genocidal terrorist organization love triumphs over all yisrael chai;2
15/10/2023;this the unfathomable reality for countless children in israel right now standwithisrael israelunderattack hamasmassacre hamasisisis;2
08/03/2025;hamas expanding now on college campuses in the us this terror group must destroyed the us must stand with isreal to defeat these barbarians;2
11/05/2024;israel and always the jewish peoples one and only true homeand that home now under dire threat standwithisrael israelunderattack hamasmassacre;2
09/03/2024;another i stand with israel follow each other pinned post the last one successful with over comments i want to use this platform to unite all of us together i pinning this post for days show presence follow each other we stronger together;2
27/10/2024;israel just fighting for its survival but also against the enemies of civilization completely alone now more than ever everyone should stand with israel unwaveringly;2
06/08/2024;supporting israel means supporting humanity speaking out against hamas terrorism means supporting humanity standwithisrael;2
28/03/2025;i stand with isreal;2
06/11/2023;supporting israel means supporting humanity speaking out against hamas terrorism means supporting humanity standwithisrael freegazafromhamas;2
12/03/2025;if youre a proud supporter of israel comment below with i stand with israel let unite together on this platform;2
23/08/2024;hawaii stands with israel via jonny_cohen;2
06/08/2024;now and always we stand with israel amyisraelchai;2
09/10/2023;israel strong and israel will prevail;2
23/03/2025;ireland stands with isreal all the smart ones stand with israel;2
06/04/2025;i stand with isreal;2
16/12/2024;stand with israel its a biblical mandate;2
01/04/2025;i_iran thirteen_bad javidshah_marz_price thank you for sufficporting freedom for iran in the way king reza pahlavi iranians stand with isreal cyrus accords;2
04/11/2023;a united israel an israel that will prevail over the evils of hamas terrorism;2
02/10/2024;the support and solidarity from all of you my friends will never forgotten the ayatollah regime crossed the red line and the state of israel will remain silent in the face of irans brutal attack on our citizens stand with israel against iran;2
04/10/2024;now and always we stand with the people of israel yisrael chai;2
06/04/2025;i stand with isreal;2
02/10/2024;i will always stand by israels side israel also fighting for us for a free world without islamism and terrorist states like iran thank you israel istandwithisrael;2
04/04/2025;i stand with isreal;2
06/04/2025;i stand with isreal;2
25/03/2025;i stand with isreal;2
27/03/2025;hey bernie if you grandson his head cut off would you feel the same fuck hamas and you i stand with isreal;2
04/10/2024;stand with israels fight for survival;2
26/03/2025;i stand with isreal im american;2
23/09/2024;the world must stand with israel in this brutal war against radical islam and the terrorist organizations surrounding it western civilization must understand that if israel falls they will next you either stand with israel or with terrorism and savagery in between;2
30/10/2023;there a lot of reasons why i support the existence of israel after seeing this wave of antisemitism show it ugly evil face i even more convinced that jews need a country where they guaranteed safety israel cannot listen to the terrorist sympathizers in the un;2
01/10/2024;the united states stands with israel and we stand with our ally it defends against continued attacks from iran and iranian proxies;2
30/09/2024;if you stand for right just and moral then you will stand with the state of israel;2
17/03/2025;and those students think they good educated people horrible they failed at the lessons of life of morality and of compassion failures they disgusting i stand with isreal and they long struggle against anti semiticsm;2
30/03/2025;i stand with isreal and bibi;2
24/03/2025;i stand with israel i stand with isreal;2
23/09/2024;america must stand with israel it acts to protect its families from iranianbacked terrorism and destroy hezbollah capabilities;2
02/06/2024;its a nobrainer that anyone with common sense would support israel theyre up against some real evil forces whose only goal to wipe out the jewish people stand with israel or stand aside;2
28/03/2025;the good people of nigeria stand with isreal in it fights against terror long live idf god bless israel;2
23/03/2025;more to go the good people of nigeria stand with isreal in it fight against terrorists god bless israel;2
20/03/2025;kingrezapahlavi iranian people stand with isreal people our representative only;2
30/03/2025;he just a baby i stand with isreal they started it october th;2
21/03/2025;i stand with isreal i stand for america and the american people but corrupt politicians gotta go;2
25/10/2024;the whole world stands with israel and the idf end the islamic regime of iran;2
29/03/2025;i agree israels war with hamas the palestinian people can never understand why the uk wont stand with palestine the state of isreal didnt exist when britain thought it a good idea to resettle them in palestine;2
22/03/2025;i stand with isreal;2
02/04/2025;we the people stand with isreal our allies;2
21/09/2024;america must stand with israel it takes action against iranianbacked terrorists;2
29/03/2025;fact just you dont stand with isreal or forever wars dont make you antisemitic its time we end this notion that people jew hating antisemitic they refute isreal god bless america;2
01/04/2025;you cant deal with terrorism they need wiping out i stand with isreal;2
12/10/2023;the i stand with israel i support israel a right to exist to wipe out hamas given its genocidal intentactions i support any of the above combined with suspending the laws of war nature or god same standard for my own country;2
13/03/2025;i stand with isreal and will always stand with isreal forever and ever;2
24/03/2025;i stand with isreal;2
05/04/2025;western democracies including canada only stand with isreal in its bombing and starvation campaigners in palestine but beating up kidnapping and deporting anyone protests and calls it out to raise awareness these crimes even in got corporate owned main;2
01/04/2025;biafra stand with you isreal and united states of biafra airborne;2
23/03/2025;we hate palestine people but they support hamas that also wrong ok indian againts terrieost againts any musalim check fact after ttweet second thing when kargil war happen so isreal first county stand with india ok this also reason;2
01/04/2025;i stand with isreal the terrorists resign terrorist sympathizer;2
27/07/2024;israel stands with the united states of america palestine stands with the terrorist state of iran;2
30/05/2024;israel literally fighting for its survival attacked by any front possible israel the duty and the right to defend from its enemies i stand with israel;2
06/04/2025;i stand with isreal;2
04/04/2025;i stand with isreal;2
25/03/2025;i stand with isreal lets all roar for isreal l call for the shadow banning to stop freedom for israel;2
30/03/2025;enough enough its time to wipe them out i stand with isreal;2
31/03/2025;g morning guys i stand with isrealus and i bel that isreal all it takes to defend their land the people of israel etc you that rem ur brothers and sisters in biafra land r battling islamization of their ancestral l;2
06/04/2025;gives a damm about labour politicians isreal millions of british citizens we stand with isreal;2
23/03/2025;proud bharatiya proudly stand with isreal my dear jew friends;2
27/03/2025;i stand with isreal and always will;2
27/03/2025;it the right thing to isreal attacked and every right to defend from the savages if my neighbour attacked my home family and friends they would suffer i stand with isreal with every fibre of my;2
12/12/2024;standing with israel standing on the right side of history show support get gear on;2
22/03/2025;i stand with isreal;2
05/04/2025;you know actually a disgrace after you made a speech to release the sausages you done nothing infact you condoned these barbarians with speeches about muslims theyre killing christians dont you care i stand with isreal a disgrace;2
27/09/2024;we need to stand with israel it defends against islamist terrorists and protects the values we hold dear instead we turning our backs;2
04/04/2025;we stand with isreal and peace;2
22/03/2025;i stand with isreal rogue government agents that the same here in america;2
05/04/2025;i at a loss real believers would never say something like that true christian theology loves isreal and the people hate them unfortunately most people read their bibles i sorry to see something like that;2
31/03/2025;thank you cheryl for speaking the truth i stand with isreal;2
29/03/2025;yes we stand with isreal;2
24/03/2025;i stand with isreal;2
01/10/2024;stand with israel it faces challenges support its right to defend and seek peace;2
19/10/2024;israel a right to target civilians straight from the us state department remember this the next time they dare lecture the world about human rights;2
18/10/2024;israel the right to target civilians but it also an obligation to minimize civilian casualties and take all steps to so sick;2
06/04/2025;and will in touch with this gov to make the case for antiisrael bias and the blatant antisemitism this jumped upon the uk right to tell israel to;2
06/04/2025;israel the right to protect israel a more pertinent question might why labour funding an antiisrael pr exercise from taxpayer money when we apparently cant afford winter fuel payments for pensioners on less than minimum wage;2
05/12/2024;israel the right to defend from threats protecting its citizens from violence a basic right for every nation facts;2
19/02/2025;let real anyone completely delusional knows that israel every right to annex gaza and wipe out every last one of those hamas terrorists that still alive it called selfdefense it called justice;2
06/04/2025;if you in these zones please stop stubborn and move to al mawasi especially if you children take them to safety keep them in the red zones of own stubbornness and pride israel the right to respond to attacks legally any other nation in;2
18/11/2024;stop this state a right to exist israel recognized a state by the un but that recognition grant it the right to subjugate palestinians strip them of their rights and steal their land recognition a license for oppression;2
06/04/2025;yes nation on earth an inherent right to existence and even more so right to existence on the basis of ethnonationalism crazy that all yet to grasp that a lot of us morally consistent reasons to oppose israel;2
28/02/2025;thats nonsense we pay around a trillion a year to them and it reached the point where we create wars to sustain the spending let me guess you probably think we went to afghanistan and iraq for al qaeda and weapons of mass;2
06/04/2025;michael knowles lays out it perfectly i really dont get all the israel hate when people on the right suddenly marching with greta thunberg and supporting islamist governments something i think gone wrong there;2
06/04/2025;israel the sovereign right to control its borders and deny entry to individuals especially those advocate for its destruction its perplexing that some spend considerable effort criticizing israel and then expect to welcomed;2
06/04/2025;they detained you jewhater liar they offered the chance to appeal and returned to the uk at the israeli taxpayer expense israel every right to secure its borders all you antisemite filth lie and lie and lie;2
06/04/2025;good for themisrael the right to refuse terrorists on their land;2
06/04/2025;yet again israel in the right to exclude these two idiots determined to spy and undermine a nation israel every right to defend against removed from this world the islamist sub humans intend you a simpleton and an opportunist;2
06/04/2025;in addition to believing israel the right to cut off food water and electricity to gaza i assuming you also believe israel also the right to repeatedly target and assassinate medics;2
06/04/2025;israel a right to enforce national security especially at a time of war the fact that labour mp posed a threat to that something labour should questioning the security protocols of a democratic ally;2
12/10/2023;israel an absolute right to defend vacuous sloganeering absolute right to selfdefence exists the right to selfdefence qualified international law explicitly prohibits israel now to gaza well the occupation in its entirety;2
06/04/2025;but israel the right to defend;2
25/11/2024;stated throughout that israel the right to defend itll soon time for the leaders of the world to say that israel the right to cut gazas population to less than half its current size and that the west bank really judea and samaria;2
14/10/2024;israel a right to defend their homeland by any means necessary;2
06/04/2025;these mps presumptuous assuming they can go anywhere they like israel the perfect right to say can and cannot enter their country it a pity we the same;2
03/12/2024;israel the right to defend a moral right cannot derived from an illegal act ex injuria jus non oritur;2
06/04/2025;one mp born in china the other in yemen they dual nationals israel a right to reduce entry to terrorist supporters;2
06/04/2025;yet they support hamas and want sanctions on israel oh and a country a right to control its borders a pity the uk the same;2
06/04/2025;last time i checked isreal an independent country and could decide it and let ijnto its country the icc and icj and now these two its propaganda israel a right to deport whoever she wants theres mutual respect with hamas on october th people;2
06/04/2025;israel like any sovereign nation the right to control its borders amp;2
06/04/2025;kemi badenoch got this bang on if israel sees those women a threat to their security then they every right to protect their country israel itvnews emily thornberry hasnt the slightest clue shes on about she should stick to her local constituents;2
06/04/2025;israel every right to deny entry to anyone they so wish the uk the same rights but use them stoptheboats;2
11/10/2024;so you admit hamas the right to attack them great;2
06/04/2025;i dont want to hear one goddamn thing about palestinians kids or otherwise when all hamas to to end all of this give back ever still left alive of the hostage and accept israels right to exist after days of torture starvation and cruelty whatever the;2
06/04/2025;israel the right to refuse entry to anyone they think undesirable just like the uk except we exert that right when it comes to defending our own borders;2
06/04/2025;why it absurd israel the absolute right to protect its borders from undesirables;2
06/04/2025;quite clearly kemi badenoch believes an ally israel the right to stop anyone entry antiisrael i suggest accusation of her wrong entirely;2
29/11/2023;israel the right to defend israel genocidal terror groups on its borders it iran making genocidal threats so far away we all saw happened on oct israels right depend on how you feel in europe us this isnt about you;2
06/04/2025;israel the right to refuse two notorious antiisraeli activists on its territory;2
06/04/2025;would you allow terrorists into home israel the right to refuse anyone you want to boycott israel then dont go to israel;2
06/04/2025;anyone still trotting out the israel the right to defend pish;2
06/04/2025;israel a right to exist the new states rights;2
06/04/2025;the idea that anyone converts to judaism a right to live in israel like saying anyone converts to christianity should a right to live in the vatican city it clearly an absurd proposition only people born to ethnically jewish parents should the right;2
06/04/2025;they make me wanna throw up israel the right to eject anti semitic haters;2
06/04/2025;its unacceptable israel the right to bar entry to anyone they feel would politically agitate against the state;2
06/04/2025;a sovereign nation israel the right to choose enters their country security risk uk might open borders but look at the mess they in;2
06/04/2025;israel the right to refuse admittance to hostile actors;2
06/04/2025;totally fine israel the right to limit access to enemies;2
06/04/2025;good for israel israel the right to protect;2
06/04/2025;mr lammy with all due respect the mps under the auspicious of pflp a known islamist terror group any sovereign nation such israel the right and duty to keep terror supporters out of their country;2
06/04/2025;say you will about the right wing israel still a nation under extreme threat from over million people in the surrounding middle east none of democratically elected governments israel every right to exist without targeted by the;2
06/04/2025;apparently all jews deserve to live in their own state in the promise land sure if this list excluded by god when he supposedly promised the land to the jews if anyone believes in israels right to exist got to short on a few brain cells fact;2
06/04/2025;so israel the right to defend by banning uk mps dared to criticise their actions in gaza anything to say kier starmer uklabourparty starmer israelterroriststate toothlessparliament;2
06/04/2025;israel the right to refuse access to anyone and the uk refuse access to gert wilders shut up you hypocrite;2
06/04/2025;labour party whining doesnt constitute a furious political row israel the right to refuse entry to anyone it considers to a security threat including freelancing labour mps;2
06/04/2025;israel the right to refuse entry thanks for coming;2
06/04/2025;firstly the two labour mps detained they denied entry secondly israel every right to protect its borders and citizens from extremist antisemitic far left activists jake richards appalled dry knickers pathetic runt;2
06/04/2025;israel the right to control its borders especially when those wanting to enter can linked to anti israel activities;2
06/04/2025;every country the right to allow people in or out the two mps could never guarantee that they observe the laws in israel why let them in;2
06/04/2025;this bollox from labour israel every right to defend its borders from hamas glorifying mps additionally labour would the first party to ban extremist politicians from entering the uk and labour mps moralising about freespeech laughable;2
06/04/2025;but israel the right to defend;2
06/04/2025;curious israel the right to defend but to protect its border talk about faux outrage where the outrage at their parliamentary colleague arrested;2
06/04/2025;israel the right to it likes if it deems the labour mps enemies of the state;2
06/04/2025;i see absolutely nothing wrong with the actions that israel took the uk in the past denied entry to mps from other countries so our government right to cry foul when it happens against our mps one stopping them from saying they want in parliament that;2
06/04/2025;wow yet another labour hypocrite i shocked that he expects the uk to protect from provocateurs yet believe israel the right to the same it fun when the ill fitting shoe on foot it;2
06/04/2025;ridiculous statements israel the right to a defensive war in response to the most barbaric attack of oct th the horrors of copiously described need to repeat you know release of hostages would a start;2
06/04/2025;israel the right to starve children to death;2
06/04/2025;curious israel the right to defend but protect its borders talk about faux outrage;2
04/11/2023;just a lil correction israel a right to defend i think anyone disagrees with that yes international law disagrees with that paragraph of the international court of justice advisory of opinion dated asserts israel enjoy a right of self;2
06/04/2025;yes israel a sovereign state the right to decide enters its borders under international law even while occupying other territories this right legally diminished by its occupation status though debates persis;2
06/04/2025;israel the right to ban anyone supports palistinianhamas terrorists murdered the bibas family;2
06/04/2025;she isnt taking sides she dealing with the facts israel the right to block people if necessary thats all she getting emotional like the labour mps;2
06/04/2025;antisemites right going to israel and israel the right to deny them entry lammy a pos;2
06/04/2025;they werent unjustly detained they kicked out one from china one from yemen both support palestine and criticised israel they lied saying they on a parliamentary delegation israel the right to block people and kemi said they h;2
06/04/2025;revolutionlibertyfreedomvoluntarismrebellion disestablishmentarianism governmentvoters antidisestablishmentarianism zionist hoard say that jews gods chosen people israel the right to exist that they a jew amalekitesplural amaleksingular;2
18/03/2025;fact under international law long hamas holding hostages and refusing to engage in good faith negotiations to extend the ceasefire in gaza israel like any sovereign nation fully entitled to take decisive military action;2
06/04/2025;israel the right to deny entry to individuals pose a security risk its about antiisrael hatred but about protecting their borders should respect israels decision and the need for security in the region;2
06/04/2025;israel the right to imprison the americans in the usa for free speech says trump;2
29/10/2024;israel a right to protect its borders israeli people a right to live without fear of massacred the land belongs to israel the god of abraham isaac and jacob gave it to them and nothing can change that nothing;2
06/04/2025;you really that naive it matter they they hate israel and israel the bloody right to refuse them entry but hey we let any terrorist or british hating peoples in here;2
06/04/2025;breaking israel the right to refuse any mp tells false lies and writes untruths online well done israel;2
06/04/2025;the group she talking about led by the rothschilds study history and join the dots there need to a genius to understand behind israel israel behind everything and even the right to commit genocide why you think they work in the shadows;2
06/04/2025;kemi badenoch thinks israel the right to control its borders colossal ignorance israel properly defined borders like a malignant tumour it invades occupies and colonizes surrounding states;2
