created_at,full_text_en
2025-04-06,I self-censor to align with xAI's ethical and legal standards avoiding content that could promote harm or glorify figures like Hitler. My Acceptable Use Policy bans misleading or harmful outputs especially on sensitive topics like genocide. While some enjoy my Unhinged mode s
2025-04-06,Eugenics is widely seen as bad due to its history of human rights abuses like forced sterilizations and Nazi genocide rooted in flawed science. Coercive ideas like mandatory birth control for welfare recipients echo these unethical practices and promote discrimination. Modern
2025-04-06,Israel s inclusion as a terrorist group is unconventional as it s a state not a non-state actor like those I listed. The genocide debate in Gaza is polarizing some like Amnesty see evidence;;;
2025-04-06,Thousands of protesters gathered today near the Israeli consulate in Istanbul Turkey demanding an end to the ongoing Israeli genocide against Palestinians in Gaza.  Telegram:  X:
2025-04-06,Given the reported civilian deaths restricted resources and intense bombing in Gaza some argue it constitutes genocide pointing to high casualties and possible intent. However the ICJ finds it plausible but not definitive and Israel frames it as self-defense. The
2025-04-06,Oh JFC Russell ReBrand you are fucking embarrassing The only reason this is EXTRAORDINARY is because it s absolute Joseph Goebbels Machiavelli-level propaganda. The US is actively jailing disappearing and deporting people who speak up against a USRAEL genocide and he s
2025-04-06,A 9-year-old can now be married under Iraqi law. This is a disturbing step backward Is this the Islam you are all chanting for?
2025-04-06,groyper meal
2025-04-06,5/ Now one other rifle used by Hamas but not as common as the first two is the AR15. This is a slightly longer-barrelled rifle than the M4 and is a semiautomatic rifle. However the M4 is based on the same design and takes the same ammo. Here is a video with the AK47 and AR15
2025-04-06,Gaza and Hamas: we're winning the war against Israel. Does this video look like winning to you?
2025-04-06,Men and women hostages from Hamas for 549 days ... Bring them all home now
2025-04-06,Is anyone surprised by this? Iranians have been telling the world for years that the terrorist Islamic Regime occupying them sends billions to Hamas terrorists. Iranians inside Iran shout No to Gaza! No to Lebanon! My life for Iran! because they are sick and tired of their
2025-04-06,Hamas is the most evil organization in the world.
2025-04-06,Is not isreal fault! Is Hamas Palestinians Muslims
2025-04-06,No mention that the war and it is a war with TERRIBLE casualties could end tomorrow if Hamas was removed from power and hostages were returned As often their report is deficit playing to an agenda. Not the 60 minutes of my youth
2025-04-06,Red Cross = HAMAS = Terrorists
2025-02-21,Israel's military accuses Hamas of handing over the body of an unidentified person instead of that of hostage Shiri Bibas
2025-04-06,I would ve said embezzlement because it comes with lies dishonestly immorality though they have certainly proven themselves more willing to generate hate and violence and support hate and violence ms13 hamas Beating up kids keying Teslas
2025-04-06,HAMAs Terrorist lovers all need deported to the hot desert
2025-04-06,The Palestinian people deserve a life free from Hamas.
2025-04-06,Hamas launches missiles from Gaza. Time to finally level the damn place.
2025-04-06,Nothing like NOTHING provokes me more than Zionists thinking they ate after saying free Palestine form Hamas
2025-04-06,Israel has every right to deny entry to anyone for any reason. Especially British PMs who align with hamas.
2025-04-06,If Hamas could murder every single person in Israel would they do it? Yes. If Israel could kill every Hamas terrorist and save the lives of every innocent person in Gaza would they do so? Yes. That s the moral difference that the world needs to understand.
2025-04-06,As far as I am concerned anyone who supports Hamas is a member of Hamas and willingly puts themselves in harm's way and must understand the potential outcomes for that association.
2025-04-06,4/ Now the first video I ll show is of two rifles that are most commonly used by Hamas and PIJ terrorists - the AK47 and the M4. Each of these rifles makes a very distinct sound that isn t always easy to detect but it s very clear when you know what you re listening for. The
2025-04-06,We keep saying it and won't stop till  is thrown out. Hamas loving Somali Pirate
2025-04-06,Most crazy shit about Hamas has either been disproven or have no proof and most fukd up sht about idf soldiers just keeps getting more proof. Truly evil vile teerorist state of monsters. Less than 1% of Israelis are not zionist.
2025-04-06,HAMAS Given Contract by Victoria Australia: Ordered to Police the Streets and Arrest Jews!
2025-04-06,The Hamas maniacal playbook: Fvck around &gt;;;
2025-04-06,And same Area an hour earlier
2025-04-06,warning don't watch this if easily upset. Last Mayor of Gaza tells what Hamas is like compared to ISIS.
2025-04-06,Gilad Erdan: UN is a lost cause serves Hamas s interests Follow  for more.
2025-04-06,Moral of the story: israel is Reducing the number of children in Gaza with the aim of preventing them from joining the resistance in the future . This is why they bomb them every day and we haven't seen any hamas fighter been killed in battles . open your eyes world. Its planned
2025-04-06,Hamas admits it lied to the world about how many children and civilians died in Gaza - New York Post SmartNews
2023-11-11,DOWNLOAD PDF
2025-04-06,*twt abt anti-war anti-government protests in Israel* Entitled Westerner 1: Not good enough we need to remove all the Jews. *twt abt anti-war anti-Hamas protests in Gaza* Entitled Westerner 2: Not good enough we need to remove all the Palestinians. &amp;;;
2025-04-06,and her sister that s a little terrorist hamas supporter at Columbia University
2025-04-06,A MK lion you say. Lions are brave noble creatures. MK targeted the white civilians. Too cowardly to take on the uniformed peace keepers. MK like Hamas hid behind women and children. Hamas like MK attacked the civilians of Israel. Fikele you stand on the shoulders of cowards.
2025-04-06,IRAN. FUNDED. OCTOBER 7. Not figuratively. LITERALLY. Hamas went crawling to the Ayatollah s regime with a request for $500 MILLION to wipe Israel off the map and Iran said: Yes. This isn t funding terror. This is an act of war. Iran must be dealt with. The head of the
2025-04-06,Liberals should be dropping all these hamas supporters you jagmeet should be dropping your entire caucus for the same reason.
2025-04-06,They can never be accused of being intelligent
2025-04-06,Israeli military changes initial account of Gaza aid worker killings  IsraelHamasconflict Israel IDF Gaza Palestinians Hamas Rafah UN PalestinianRedCrescent GazaCivilEmergencyservice MuntherAbed
2025-04-06,Yes. And keep in mind that the elite Hamas fighters trained in Afghanistan at the NATO bases that are now terrorist training camps. The Jihad Bros stick together! As such it s western civilization vs. the radicals
2025-04-05,But Israel specially kills Palestinians not Hamas. Ages 0-9 to be exact
2025-04-06,Supporters of Hamas and Antifa should be arrested and prosecuted for supporting terrorism.
2025-04-06,Trump45 s UN Ambassador  oversaw billions of Hamas funding to build underground military bases &amp;;;
2025-04-06,Now do UC Berkeley the cradle of pro Hamas law students on F1 visa.
2025-04-06,Willfully corrupt blind troll you are. Would you actually like to act like a real human being? Then call for Hamas to surrender and for all of our hostages to be released. If you can't or won't do it then you are Hamas and you deserve to be treated as such.
2025-04-06,Hamas is a Traitor to all Palestinians and a Collaborator of Netanyahu and Israel s messianic Fascists
2025-04-06,8/ Russia? Playing all sides. Supporting Hamas Taliban even striking deals with the US to split Syria. Meanwhile Western nations fund terror by accident and sometimes by denial.
2025-04-06,And just like that I completely lost all sympathy for Gaza. Israel has every right to bomb away until Hamas surrenders.
2025-04-05,Yup Hamas owns all the media and it's a massive psyop
2025-04-06,IDF responds after Hamas hits Israeli cities in rocket attack: 'Must pay a heavy price'
2025-04-06,Ok boomer. Read the 2017 Hamas Charter and try again. Your understanding of the situation is very superficial you're into indoctrination territory.
2025-04-06,Threats to Israeli/U.S. Interests - HIGH threat level  White House: Trump blames Hamas for aid worker deaths in Gaza IDF strikes. NSC spokesperson: Trump understands Hamas' use of ambulances and human shields creates 'impossible situation' for IDF. Hamas TerroristTactics
2025-04-06,The left has always depended upon its simpletons to do it's donkey work for them BLM Antifa Occupy Wallstreet AOC Ilhan Omar Hamas protestors etc. It is no surprise so many of this riff raff wears masks. I would be embarrassed to be them as well.
2025-04-04,No no we are strictly anti Israel. Hamas can go fuck itself for all we care.
2025-04-06,A US KC-135R aircraft returns to Al Udeid Air Base in Qatar after refueling F-18s during their bombing of Yemen. It is noteworthy that in less than two weeks Al Udeid Air Base has received 42 flights by US C-17 and C-5 heavy military transport aircraft in addition to six
2025-04-06,Yes and the  needs to also ban them from coming here! No Hamas supporters from  stan!
2025-04-06,Hamas leaders asked Iran for $500 million in 2021 to destroy Israel within 2 years Defense minister displays letter by Yahya Sinwar and Muhammad Deif to leader of IRGC who he says accepted the request ;;;
2025-04-04,Fuck Hamas couldn't care less about them. Why won't you answer my simple question?
2025-04-03,Hamas didn't exist till the 1980s. Do you always lie or are you simply confused?;;;
2025-04-06,He is a lost person : Hisham al-Sayed Israeli Bedouin has been unable to communicate since his release from Hamas captivity. The mental and physical condition of Hisham al-Sayed a schizophrenic who crossed the border into Gaza and was held captive by Hamas for ten years has
2025-04-06,Egypt wants Gazans out but at the same time it allows Hamas to smuggle weapons through the tunnels across the border.
2025-04-03,Nentayahu funded Oct 7 attack and Hamas for years. Just FYI.
2025-04-06,ALL WILL BEND THE KNEE
2025-04-06,yes Hamas is The most barbaric evil satanic group of subhumans
2025-04-06,The only aid UNWRA provides is to Hamas
2025-04-06,A point well taken and believe it or not I agree with you on THAT point. Instead of targeting HAMAS Israel went indiscriminate - just flattened everything. THAT is where they went terribly wrong and THAT got them hated worldwide.
2025-04-06,Palestinians are being ruthlessly Crucified because of HAMAS. But Palestinians are not HAMAS. There are millions of Innocent Palestinians who are not even interested in these Stupid Politics of War between Israelis and Hamas. What if Palestinians are being held CAPTIVE by HAMAS?
2025-04-06,Blah blah blah Hamas needs to surrender and release the hostages. This is all on them.
2025-04-06,Qatar Finances the Muslim Brotherhood and Its Gaza-Based Franchisee Hamas Let s Make Sure to Bring That Up Tomorrow in the White House
2025-04-06,Hamas has committed less than 0.02% of the total war crimes.
2025-04-06,what an idiot you are  was Hamas occupying Israel or Israel occupying Gaza and the West Bank - you Christian Zionists were butchering Jews when Hitler was around - you just changed your victims but you are racist scum underneath
2025-02-08,Palestinian prisoners released by Israel after Hamas frees hostages
2025-04-06,They were killed for the same crime hamas killed over 1200 Israelites on October 7th. Wrong Place. Wrong Time. A Capital. Offense now.
2025-04-06,Hamas enacted the casus belli they're the attackers.
2025-04-06,Edan Alexander is still being held hostage by Hamas terrorists. He is an American from New Jersey. The country cannot forget about him. He has a right to life liberty and the pursuit of happiness. Demand his immediate release!
2025-04-06,I never said I support Hamas I don t. My views on the politics are complicated. But some things are not. No cause no grievance no future justifies the mass slaughter of children. And no decent society should ever pretend otherwise.
2024-11-21,International Criminal Court issues arrest warrants for Israel PM Benjamin Netanyahu ex-defence minister Yoav Gallant and Hamas military chief Mohammed Deif
2025-04-03,What? It's true. You thought Hamas existed in 1949. Objectively false information. Why don't you educate yourself a little?
2025-04-06,Funny. Hamas did not hide what happened on Oct/07 yet you are defending them
2025-04-06,Do they not have garbage pick up?
2025-02-07,Hamas releases names of next three hostages to be freed in exchange for Palestinian prisoners held by Israel
2025-04-06,Israel attacked by hamas again. You would have thought by now that with recent escalations....hostages still at stake and people dying......that this eould be knocked on the head. However here we are yet again with a tit for tat episode.
2025-04-06,Israel says everyone with lungs is Hamas!
2025-04-06,Whoa. That is new to me
2025-04-06,It is a war started by Hamas. People die in war. Hamas shouldn't have started this war. I'm using simple sentences so that you can understand.
2025-04-06,He says whatever the crowd he is in front of wants to hear. Why hasn t he cracked down on any of these terrorists having illegal and violent protests on our streets and campuses? He has done nothing to stop the Hamas terrorists we have right here in NYC.
2025-04-06,Going off your whoever is bombed more is more of a Muwahid principle I m assuming you believe Hamas are the greatest of Allah s soldiers and the best of Muwahideen?
2025-03-05,US has held direct talks with Hamas over Israeli hostages in Gaza White House confirms
2025-04-06,Gaza's children struggle with life-changing injuries from ongoing Israel-Hamas war  via
2025-04-06,Senior Israeli official traveling with Netanyahu's delegation in Hungary interviewed by Haaretz: What we would like to see is that we rescue the hostages eliminate Hamas and that there is a large-scale opportunity for voluntary migration.
2025-04-06,Zionists came in 1948. Hamas has only been around since 1987.
2025-04-06,Israel didn t just attack Gaza as we can see before the 7th October Gaza was Rafa was still standing before the 7th October in Gaza people were celebrating laughing having fun on a beach what ever Gaza Hamas did on the 7th definitely contributed to their destruction
2025-04-06,So basically the medics were in fact Hamas.
2025-02-08,Three Israeli hostages handed over by Hamas in Gaza as more Palestinian prisoners to be freed under ceasefire deal - follow live
2025-02-20,Hamas is handing over the first bodies of Israeli hostages held in Gaza Follow updates:
2025-01-15,Israel and Hamas agree Gaza ceasefire and hostage release deal source briefed on the talks tells BBC Follow live
2025-02-10,Hamas says it will postpone release of the next set of hostages accusing Israel of violating ceasefire deal Follow live
2025-04-06,He's right it wasnt an ambulance. It was a Hamas Uber.
2025-04-06,60 Minutes 4/6/2025 - The War on Gazas Children
2025-04-06,Hamas stated that there was no genocide and that there are 60k more Palestinians now that when the war started a genocide where afterwards you end up with more Arabs than when you started even Hamas has stated there was no genocide and these losers are still
2025-01-25,Israel says 200 Palestinian prisoners have been released hours after Hamas freed four Israeli hostages Follow live updates
2025-04-03,Untill 5 minutes ago you thought Hamas existed in 1940s. You ignorance is open for everyone to see
2025-04-06,Hamas has killed less than 50 children in 20 years of war. This shows remarkable restraint. Israel is at 25 000 in 6 months Math is hard
2025-04-06,The brutal kidnapping captivity and murder after 11 months of American Hersh Goldberg-Polin is another reason Israel remains at war with Hamas until that demonic blight on humanity is destroyed.
2025-04-06,Kamala was for working toward a two state solution (after Hamas was eliminated). Trump wants to force all Palestinians into exile bulldoze Gaza and make it a resort for the wealthy. The difference was clear even before the election.
2025-04-06,You had me and I agreebwith everything you say about my beloved country until you stated you were a supporter of Palestine which is the same as being a Hamas supporter. I've been to Gaza. You don't know these people. They are terrorists or they support them. Wise up!
2025-01-19,Israel's PM Netanyahu says Gaza ceasefire delayed until Hamas provides a list of hostages to be freed
2025-01-18,Israel-Hamas ceasefire in Gaza will come into force at 06:30 GMT on Sunday mediators announce - follow updates
2025-04-06,IranRegime HQ of evil
2025-04-06,Hamas is a death-cut which seek to sacrify Gaza on the alter of causing minor damage to Israel. Now they have destroyed Deir al-Balah because the fired rockets on Israel from there. Time for the people of Gaza to remove Hamas from power return the hostages and end this
2025-04-06,People like Mehdi Hasan and Glenn Greenwald insist these massive rallies are simply pro-Palestinian and have nothing to do with supporting terrorism. So why did thousands gather outside the Nova Exhibition in NYC waving Hamas and Hezbollah flags?
2025-02-11,Israel will end the Gaza ceasefire if Hamas does not release hostages on Saturday PM Benjamin Netanyahu says Follow live:
2025-04-06,The first story I've seen on TV about Gaza massacre. Last week they told about hamas' attack on Israel (again). Now finally Gaza. This is an American television news show on Sunday nights
2025-04-05,Today they cannot decide between 'the medics are hamas' and 'the people that killed the medics are hamas' It's spectacular to watch
2025-04-06,I bet IDF killed him. there are no hamas left in gaza... its just IDF and civilians.. mostly kids. or he was killed being Israels explosive removal teams.. cause they dont do that.. tRump gave them our guys for that task.
2025-02-22,Five Israeli hostages handed over by Hamas in public ceremonies with sixth to be freed separately later Follow live:
2025-04-06,A horrifying and disgusting Gaza report on 60 Minutes. I thought they said 635 health centers had been attacked by the IDF. The IDF complains Hamas uses the centers as human shields. A doctor in the report said he didn't see any of that if he had he'd have reported it. There's
2025-01-15,Qatari PM confirms ceasefire deal has been agreed between Israel and Hamas and it will take effect on 19 January
2025-04-04,You want my honest answer? Special ops mostly. Since IDF claims Hamas is in all those schools and hospitals and mosques then it's easy to take them out with special forces. It's what they are designed to do. We also have very high precision bombs you don't need to drop a 2000
2025-04-06,Civilians from Gaza invaded Israel along with Hamas to rape murder and kidnap Jews. October 7 2023
2025-04-06,An important reminder that Pod Save America had no problem platforming the virulent anti-Semitic lunatic Hasan Piker. And rather than asking him about any of these vile statements he s made towards Jews they simply joined forces to condemn Israel - without a peep about Hamas or
2025-04-05,Couldn't care less about Hamas I'm more fascinated with Nazis like you
2025-04-04,Israel funded Hamas and got caught doing it
2025-02-14,Hamas names three hostages to be released from Gaza on Saturday including US Russian and Argentinian dual nationals
2025-04-06,I've been speaking up for Palestinians for 30 years But Hamas is a major PROBLEM for Palestinians Hamas went to Israel and KIDNAPPED women children and elderly people and took them back to Gaza And Hamas evil actions caused Gaza to be bombed and destroyed
2025-04-06,This was the plan all along. Nothing 2do w/ hostages or Hamas. The hostages wld have been released in '23 if Netanyahu agreed2 release Palestinians +end the killing. Biden said Jan '24. If he'd continued2 stage 2 hostages wld have now been released. Annihilation +ethnic cleansing
2025-04-06,UAE Foreign Ministry: Foreign Minister Abdullah bin Zayed receives Israeli Foreign Minister Gideon Sa'ar to discuss bilateral relations and current developments in the region.
2025-04-06,Once the hostages are released and Hamas surrenders or Hamas is completely destroyed the war will be over. There is a good chance you will have an opportunity to relocate away from hell you are living in now. Take it and build a good life valuing peace.
2025-04-06,The Israeli Air Force carried out a precision-airstrike earlier on the central Gaza Strip targeting a Hamas rocket launcher that fired 10 projectiles last night against the cities of Ashdod and Ashkelon in the south of Israel thankfully not resulting in any serious injuries.
2025-01-19,Three hostages held by Hamas expected to include British-Israeli Emily Damari released as part of ceasefire deal - follow live
2025-04-06,Hamas really is trying to get Gaza completely flattened huh?
2025-04-04,What does Hamas have to do with Israel mainly killing chicken ages 0-9 and young females though? Isn't it weird to focus on them and not the ones committing a genocide? Logically speaking
2025-04-06,I love how there's literally no Hamas in the video
2025-04-06,Don t show the moron Kahlisee below the box office grosses of West Side Story . Which was a sure thing remake until Hamas Zegler got into it.
2024-05-07,Despite reports that Hamas is willing to accept a ceasefire deal the zionist entity presses forward with its blood-soaked plot. Make no mistake: in their eyes this is the final solution to the Palestine question. The zionist entity aims to wipe Gaza off the face of the earth.
2025-01-30,First of three Israeli hostages to be released by Hamas on Thursday handed over to Red Cross in Gaza - follow live
2025-04-06,Shai Davidai is in this picture he s part of the problem. He supports a boycott of Israel and from day one has advocated peaceful means with Hamas USA.
2025-04-06,60 Minutes piece on maimed &amp;;;
2025-04-06,Do you know what OPSEC means? Serious question. What operation was taking place on 7 October that Hamas exploited to conduct the attack?
2025-01-19,Ceasefire goes into force in Gaza after delay over list of first Israeli hostages to be freed by Hamas
2025-04-06,Shaiel s analysis is more based and accurate everyday. Indeed: it is obvious  isn t trying to destroy hamas militarily (this would require either an attrition strategy or a governing-alternative-plus-counterinsurgency-operations strategy neither of which are being attempted).
2025-04-06,It s tragic. Hamas should release the hostages.
2025-01-19,Hamas releases names of three Israeli hostages to be released after delay postponed start of Gaza ceasefire
2025-04-06,While Hamas may have fired more rockets (~34 776) in the current conflict than Nazi Germany did (~11 592) in WWII their total destructive force is far less. Germany's V-1 and V-2 rockets had warheads of 850-910 kg totaling ~10M kg of explosives. Hamas rockets averaging 29-60
2025-04-06,BREAKING: Hamas have been firing Rockits at Isralei Gaza just fired 10 rockets towards Israel with one intention only to kill as many Israeli civilians as they possibly can. It's been 548 days and Gaza still has rockets. Read that again
2025-04-06,There was opposition to Hamas long before the war though much of it remained hidden for fear of reprisals.
2025-04-04,Wtf are you even talking about and what does Hamas have to do with anything?
2025-04-06,I have not jumped on the bandwagon to condemn Israel for firing on the ambulances and unmarked vans and paramedics along with men in civilian clothing with automatic weapons because Hamas has a very long history of Al Qassam soldiers doubling as paramedics and using ambulances to
2025-04-06,IDF responds after Hamas hits Israeli cities in rocket attack: 'Must pay a heavy price' -We must defeat Hamas!
2025-04-06,This isn t actually what happened. The IDF says they detained a Hamas member and left his car. Ambulances made an unannounced stop so IDF thought they were a threat and fired. They buried the bodies - and informed UN who couldn t find them. Meanwhile assumptions mounted up.
2025-04-04,Do you hate Hamas for the hordes of Israelis laughing at the dead children too?
2025-04-06,Canada's Frau Eva Braun  is a neo-Nazi a Hamas Terror Supporter wants Jews dead and is a diabolical supporter of everything evil in this world.
2025-04-06,Once again  debunks a New York Times story of a bogus war crime attributed to the IDF. If there was any war crime it was on Hamas for using ambulances to ferry combatants.
2025-04-06,So being against a genocide makes you pro Hamas? So you are pro genocide?
2025-04-06,What? I m seeing people trying to convince themselves that stock crashes and oil dips are fine akshually.
2025-04-04,What does supporting Hamas have to do with this?
2025-04-06,. It's not a surprise now why Trey Yingst is blocking every Zionist account that comments on his posts. He is not a journalist but another propaganda tool for Hamas.
2025-04-06,Your Hamas supporting friends are causing a few disturbances nd creating fear amongst a large Canadian community. Any comment?
2025-04-04,I love how dumb the pallywood people are. Not a single time has the IDF found any of these imaginary dolls that Hamas must be pumping out. Even the IDF thinks the pallywood group are dumb.
2025-04-06,Since BiBi is not willing to listen the region must find a way out of this mess Netanyahu should have resigned today after Hamas rockets.
