created_at,full_text_en
2025-04-06,War's toll on Gaza's children  via
2025-04-06,Israel Leveled Gaza Then Killed the Drone Journalists Who Showed it to the World Only drones can begin to capture the scale of destruction in the Gaza Strip. The journalists doing it were targeted again and again.
2025-04-06,Rockets from Gaza fired towards Ashdod and Ashkelon for the first time in months.
2025-04-06,The Chicago surgeon treating wounded in Syria Ukraine and Gaza  via
2025-04-06,Trump s Pick for Israel Ambassador Leads Tours That Leave Out Palestinians and Promote End of Days Theology Trump wants Gaza for real estate deals but Mike Huckabee s all-inclusive Israel tours erase Palestinians for a higher purpose.
2025-04-06,The Guardian provides a full account of diabolical war crime. Israeli military changes account of Gaza paramedics killing after video of attack
2025-04-03,Yeah but nothing on the scale we are seeing now. In fact what is going on in Gaza has no historical precedent. It is unique. Even ww2 the Nazis had a 6% child kill rate. Israel is now at 46%
2025-04-06,BREAKING: The Israeli military is reportedly carrying out a large-scale invasion across the West Bank ahead of tomorrow s general strike protesting the genocide in Gaza. Drop Site contributor  says Israeli forces are raiding Qalandia Jalazone and Am ari refugee
2025-04-04,I've seen more than 20 real Muslims die in Gaza their bravery is unquestioned. So it's more than 20 but I see what you mean
2025-04-04,Obviously the footage I sent you is only a fraction of the Gaza footage but it gives you a very clear picture.
2025-04-06,The holocaust in Gaza just keeps accelerating. Another journalist targeted by the ZNazis.
2025-04-06,Yes and? Maybe that s by virtue of all the stuff they ve done and were planning to do Does being MP give an absolute immunity to go anywhere you want especially on a hatred pet project like Gaza? Want the hostile stances; face the consequences. That s how it s always worked
2025-03-18,The genocide never ended and we will never be silenced. We continue to stand with our brothers and sisters in Gaza in the face of this continued onslaught. AllEyesOnGaza GazaUnderAttack
2025-04-06,Dupes manipulated by the Muslim Brotherhood captured on video. Everyone of our cops should spend time with the IDF in Gaza to learn how these terrorrists roll. Frigging ridiculuous.
2025-01-01,As healthcare workers and students we have a moral imperative to use all available resources and channels to ensure the safety and protection of healthcare workers in Gaza particularly Dr. Abu Safiya whose life and work are in immediate danger.
2025-04-06,Yemen reports 6 deaths in US air strikes Netanyahu orders new attacks on besieged Gaza as Tel Aviv's genocidal war on the blockaded enclave enters its 548th day Follow our live coverage
2025-01-19,Israel's PM Netanyahu says Gaza ceasefire delayed until Hamas provides a list of hostages to be freed
2025-02-14,Hamas names three hostages to be released from Gaza on Saturday including US Russian and Argentinian dual nationals
2025-02-11,Israel will end the Gaza ceasefire if Hamas does not release hostages on Saturday PM Benjamin Netanyahu says Follow live:
2025-04-06,They didn't slaughter mainly children ages 0-9 in Afghanistan anywhere near Gaza. You are making things up.
2025-04-06,Im comparing Oct 7 footage to Gaza war footage. Duh
2025-03-18,Over the past two months the Zionist state of Israel has continually violated the provisions of the ceasefire agreement acting with impunity and the full backing of the imperialist Western world. Now the Zionist entity is continuing the genocidal bombardment of the Gaza Strip
2025-04-06,The IDF changes it's story
2025-04-06,Thousands of protesters gathered today near the Israeli consulate in Istanbul Turkey demanding an end to the ongoing Israeli genocide against Palestinians in Gaza.  Telegram:  X:
2025-01-30,Two more Israeli hostages and five foreign nationals handed over to Red Cross in Gaza Israel's military says - follow live
2025-04-06,The Israeli Air Force carried out a precision-airstrike earlier on the central Gaza Strip targeting a Hamas rocket launcher that fired 10 projectiles last night against the cities of Ashdod and Ashkelon in the south of Israel thankfully not resulting in any serious injuries.
2025-01-25,Four female Israeli soldiers held in Gaza handed to Red Cross in second hostage release of ceasefire deal
2025-04-06,President Macron's 48-hour Cairo visit includes talks on Gaza a summit with Jordan's King Abdullah and a visit to the Grand Egyptian Museum
2025-02-05,President Trump suggests the US could take over Gaza in joint news conference with Israeli PM Netanyahu Follow live
2025-01-19,Ceasefire goes into force in Gaza after delay over list of first Israeli hostages to be freed by Hamas
2025-01-27,Thousands of Palestinians begin returning to north Gaza after deal is reached to free Israeli hostages - follow live
2025-04-06,Breaking | A devastating airstrike by Israeli forces has targeted a journalists' tent near Nasser Hospital in Khan Younis southern Gaza resulting in multiple deaths and injuries
2025-04-06,Gaza ceasefire collapse: UNRWA
2025-01-30,First of three Israeli hostages to be released by Hamas on Thursday handed over to Red Cross in Gaza - follow live
2025-01-19,Photo shows British-Israeli hostage Emily Damari reunited with her mother for the first time since being released from Gaza - follow live:
2025-04-04,It's your luck day. The total footage from Oct 7 is around 0.02% of the total footage we collected in total from Gaza. I know because I submitted it to the ICC in full. Here's 80 000 raw videos of mostly children and women being killed by Israel.  Also
2025-04-06,Because the PCRS isn't a British NGO and even if it was Gaza is not considered behind enemy lines it's just a city.
2025-01-19,Hamas releases names of three Israeli hostages to be released after delay postponed start of Gaza ceasefire
2025-04-06,Another Palestinian journalist killed in Israeli airstrike in Khan Yunis southern Gaza
2025-04-06,I suspect Ukraine Yemen and Gaza could be drawn out for this reason. A prolonged war is the ultimate Keynesian stimulus package. Especially in Yemen and Gaza. It is prolonging suffering to show strength maintain a strategic advantage and keep economies from failing.
2025-04-06,Israeli fighter jets launch a series of airstrikes targeting the northern areas of Deir Al-Balah city central Gaza Strip following the launch of 10 rockets from there. HamasNazis
2025-04-06,Why not? Churches in Gaza have tons of crosses and Palestinian Christians have no problem. Wtf are you talking about?
2025-04-06,Oh then the answer is because they operate many offices hospitals and musical outposts in Gaza. As does the UN. This is normal stuff they rescue people everyday
2025-04-06,Jackson Hinkle likely believes Netanyahu belongs in prison due to an ICC arrest warrant issued in Nov 2024 for alleged war crimes and crimes against humanity in Gaza like starvation as a warfare method and murder. Hinkle s post aligns with his critical stance on
2025-04-06,Nope Israel
2025-04-06,We had prepared a beautiful room for him a warm bed a home filled with safety and calm. Instead he was born into a life of exile  Opinion by Shaimaa al-Durra
2025-04-06,Breaking | A journalist was killed and several others were injured after an Israeli airstrike hit a tent at Nasser Hospital in Khan Younis southern Gaza
2025-04-06,Not even the IDF claims that. You lie
2025-04-06,No this has been thoroughly investigated and even Israel admits it
2025-04-06,If we didn t exclude those who left Gaza the population wouldn t drop by 160k since Oct 7 2023. With ~55k births and ~55k deaths it d stay near 2.2M not 2.1M. Emigration (100k) drives the big decline without it natural change is near zero. Exact numbers vary due to conflict
2025-04-06,Israel s inclusion as a terrorist group is unconventional as it s a state not a non-state actor like those I listed. The genocide debate in Gaza is polarizing some like Amnesty see evidence; others like the AJC call it self-defense. US aid ($3.8B/year + $14B in 2024) fuels
2025-04-06,Based on my analysis the claim about General John Pagri's death in Gaza appears to be fake news. There's no record of him or a Special Tasks Battalion in the U.S. Army and no credible sources confirm this event. The image's watermarks also suggest it s from an unverified
2025-04-06,Palestinian militant group Hamas said it fired a barrage of rockets at cities in Israel's south on Sunday in response to Israeli massacres of civilians in Gaza. Click the photo to read more:
2023-11-04,do what u can as simple as pray. dont stop talking about this genocide braw!
2025-04-06,Dear World It s not the Rwanda genocide. It s the Genocide Against the Tutsi. Words matter. Truth matters. Please get it right and help us protect the memory and dignity of the victims. Kwibuka31 SayTheRightName
2025-04-06,The real terrorists  Yemeni Gaza Perfect10Liners TrumpTariffs Gaza_Genocide
2024-10-29,AniesBacaBuku A Diary of Genocide
2025-04-06,Amazing vocals! Song about the genocide of the Pontiac Greeks by the Ottoman Turks.
2025-04-06,I from Malaysia along with my Uyghur brothers boycott Shein Temu Chinese products and any products that support genocide and slavery against Uyghur Muslims. Boycott American Products (owned by Zionist Jeews) is good but don't forget to boycott Chinese Products.
2024-11-24,GENOCIDE PELOSI YOU HAVE BLOOD ON YOUR HANDS. US AND SF STATE STUDENTS SAY NO AIPAC-FUNDED AWARD CEREMONY FOR NANCY PELOSI. On November 21st and as part of the international call to action USFCA SJP and SFSU GUPS held a picket line at the Hyatt Regency in protest of USFCA
2025-04-06,End Times Dystopia fueling anti-Christ End Times Genocide in The Holy Land
2025-04-06,Genocide is the industry of Israel
2025-04-06,Hats off to the most courageous Engineer IbtihalAboussad Billgates_supports_genocide Shame on you
2025-04-06,As we honor the lives lost in the 1994 genocide against the Tutsi let s commit to remembering and building a future rooted in unity and peace. Remember Unite Renew Kwibuka31
2025-04-06,It is not anti-Catholic to hold the state of Canada to account for its genocide of Indigenous peoples and it's not anti-semitic to hold the state of Israel for the genocide of Palestinians. All states around the world must follow international human rights laws. It doesn't
2025-04-06,i am considering purchasing a rickenbacker even though every bassist who's ever played a rickenbacker has not enjoyed playing a rickebacker
2025-04-06,Rwandan genocide: thousands dead. Kagame's role controversial. Involved in DRC wars (millions dead). Kagame's responsibility in the Great Lakes killings: open question. Rwanda DRC GreatLakes
2025-04-06,Let hope be your guiding light inspiring you to build a brighter future for our nation and generations to come.Embrace the journey from the darkness of the Genocide against the Tutsi 1994 in Rwanda  to the light of a new beginning filled with hope and promise.
2025-04-06,Tel Aviv and Berlin - a perfect match based on our common values of barbarity and genocide.
2025-04-06,I just signed a  petition: Microsoft: End Complicity in Apartheid and Genocide. Sign here:
2025-04-06,As we remember the Genocide against the Tutsis in Rwanda we join our voices together to say: Never Again Must Mean Never Again! Kwibuka31 VisitRwanda
2025-04-06,As we mark Kwibuka31 we remember the over one million innocent lives lost during the Genocide against the Tutsi. To all survivors your strength courage and resilience inspire us every day.
2025-04-06,Mitdash Stands together with the Rwandan Community to commemorate the 1994 Tutsi Genocide. Remember we build memory31 mitdash
2025-04-06,Gaza: Genocide in the Age of Artificial Intelligence and Global Surveillance  via
2025-04-06,Today we remember 31 years since the genocide against the Tutsi in Rwanda. We honour the victims stand with the survivors and commit to fighting hate in all its forms. Kwibuka31 RememberUniteRenew
2025-04-06,Today marks 31 years since the 1994 Genocide against the Tutsi. As we begin the official commemoration week we honor the memory of the victims and reaffirm our commitment to remembrance unity and renewal. Turibuka Twiyubaka! Kwibuka31 WeLoveYouRwanda
2025-04-06,TRUMP: Lebanese Hezbollah &amp;;;
2025-04-06,Genocide Gaza Israel GazaHolocaust IDF stockmarketcrash bbtvi IsraelTerroristState This is a human being being burned in front of the world. The ones who burned him were the Jews.
2025-04-06,They are spineless selfish greedy maggots afraid to stand up for Auschwitz camp of Gaza daily slaughter of civilians. You re also accomplice in this genocide may be dreaming to enjoy the future riviera planned by the orange clown on the graves of Palestinians shame on you
2025-04-06,&gt;;;
2025-04-06,Who says genocide has to be depressing?
2025-04-06,After the laurea honoris causa in Hungary genocide criminal cross Italy  France  and arrive in  a HELL of welcome with bloody carpets  USA wake up
2025-04-06,Very brave Microsoft engineer Ibtehal Abu Saad disrupted the company s 50th anniversary accusing AI chief Mustafa Suleyman and Microsoft of aiding Israel s genocide in Gaza through tech and military contracts.
2025-04-06,Today marks 31 years since the 1994 Genocide against the Tutsi. Remember Unite Renew Kwibuka31
2025-04-06,X is deleting pro-Gaza accounts. Muslims are being brutally killed before our eyes. Innocent kids with dreams &amp;;;
2025-04-06,Beshear is the only one of those that I would approve of running and even then only if Pete Buttigieg stays out. Nominating a woman again is risky and Newsom is an ignorant person that stands for nothing while Shapiro supports genocide in the West Bank.
2025-04-03,The most well documented genocide in the history of mankind bar none.
2025-04-06,57 countries exposed by Gaza Genocide
2025-04-06,Well i would summon one like you to fight a kid that wants to commit genocide on a large scale and then watch Also you didn't need to remind of my romantic failure of life
2025-04-06,Gaza children Gaza_in_Genocide GazaGenocide
2025-04-06,Download  and  to ensure that you are not purchasing items that are complicit in Israel's genocide. We do what we can with the choices that we have. We must keep ramping up our efforts. Boycott Israel. Boycott those who are related to Israel.
2025-04-06,How many students support genocide?
2024-11-07,From  JAIL SUPPORT NEEDED 2 protestors were arrested after Palestinian students and community members disrupted genocide denier and notorious sellout Yossef Haddad's event in Chicago. ZIONISTS AND CPD ARE GETTING AGGRESSIVE Mobilize to jail support now!
2025-04-06,Gaza children Gaza_in_Genocide GazaGenocide
2025-04-04,Only sick individuals will focus on the victims of a genocide and ignore those committing it. You are a sick individual
2025-04-06,The last chapter: 2022-2026: The final collapse of russia after starting a war of conquest and genocide against Ukraine return to the Middle Ages to see if it is possible to create a normal country from it.
2025-04-06,The taliban genocide of women
2024-11-21,ALL OUT TO SARAH LAWRENCE COLLEGE! DEFEND THE STUDENT INTIFADA! For over 400 days our institutions have ignored the genocide of our people in Gaza we DEMAND that they disclose their financial investments and they DIVEST FROM DEATH Rally to Demand Disclosure Divestment
2025-01-29,DROP THE CHARGES AGAINST UMAYMAH MOHAMMED: EMORY STUDENT UNDER ATTACK We stand unequivocally with Umaymah and her truthful statements that any physician-faculty who served in the IOF these last sixteen months perpetuated genocide.
2025-04-06,END THIS GENOCIDE
2025-04-06,Oh yeah the wealth tax she was TOTALLY gonna try and pass right after she stopped the genocide right?
2025-04-04,I think the issue with Indians is their ignorance. For instance most think that Kashmir is horrific where around 300-400 children died but don't think Gaza is a genocide where 20 000 children have been killed and where Israel mainly kills children ages 0-9. Not adults.
2024-11-21,TOMORROW students lecturers professors and university staff members across the globe will refuse to attend classes or go to work. We will be bringing our institutions to a grinding halt as the struggle against Israel's genocide of the Palestinian people and against the states
2025-04-06,yo  genocide is bad but so is she
2025-04-06,Genocide clear as day.
2025-04-06,Israel is a terrorist entity committing genocide and apartheid with the support of USA UK Europe and the coward Arab leaders. Zionists are barbaric and can't be among the civilized nations of the world
2025-04-03,Western university students are doing more than the entire Arab world combined to end the genocide. Except Yemen of course
2024-11-22,Statement on recent events: Four students of color at the University of Rochester were arrested for exposing administrators and trustees ties to genocide and repression. In response the University has deployed the full arsenal of the criminal legal system to punish them.
2025-04-06,Stop the Genocide_in_Gaza please
2025-01-21,Harvard s response to the genocide in Gaza:
2025-04-06,The sanitising of genocide &amp;;;
2025-04-06,More from the most moral army in the world Genocide_By_Israel GenocideinGaza WarCrimes
2025-04-06,Yousef is EXHAUSTED from this GENOCIDE Food and water are rare and very costly. With your help he can SURVIVE and his family too. Please DONATE TO HIM AND SHARE.
2025-04-06,Never forget this list. They are all genocide facilitators and helpers. They should pay as Israel will...
2024-10-08,The pro genocides don't have any argument to justify why they do support genocide instead of humanity &amp;;;
2025-01-15,Today January 15 a ceasefire ends 15 months of israel's horrific genocide in Gaza. Today Palestinians celebrate with those around them;;;
2024-12-14,from Vassar SJP on IG: Early this morning a group of autonomous actors tagged Vassar College a neoliberal corporation manufacturing consent for and investing in israel's ongoing genocide in Gaza the occupation of the West Bank and the recent zionist escalations in Lebanon
2025-04-06,Ashraf and his family are facing the harsh reality of genocide and famine . The most basic needs food clean water and other essentials are now completely out of reach where a single bag of flour costs over $200 pls donate and share
2025-04-06,Yep. They wanted genocide.
2025-04-04,Muslims in India don't support the genocide though generally speaking
2025-03-24,Our universities have long established themselves as factories that produce ideological and vocational training for US imperialism. In this mission they serve as direct arbiters that facilitate the ongoing genocide of the Palestinian people.
2025-04-04,You knowingly or unknowingly fund the genocide. Muslims can't even do something as simple as collectice boycotting. It's shameful
2025-04-06,Our society is imploding and your method of coping is to come online on this app to scream at dying civilians during a genocide. Fascinating to watch truly
2025-04-06,Connect. You voted for GENOCIDE. AND. ANNEXATION.
2025-04-06,So you wanna tell us that oppression occupation land theft expulsion and genocide are common values for Tel Aviv and Berlin? Wow.
2025-04-06,In the near future it shouldn't surprise anyone if States take actions against people like this. Sowing discord and promoting the genocide of my people while having a massive online following? That's a national security threat
2025-04-06,Damn Americans are so racist this is their response when confronted by the genocide their tax dollars pay for. That country is doomed man.
2025-04-06,How will history judge the USA EU and the UN for allowing this GENOCIDE to go on!?
2025-04-06,Beginning with the Napoleonic wars and then on to World War 1 2 and this current incarnation those are all Jewish conspiracies to genocide as they call non Jews the Goyim. That's primarily White Supremacists or Gentiles. Again it's a conspiracy for genocide.
2025-04-06,Funny how same people think South Africa correcting its land ownership laws amounts to GENOCIDE.
2025-03-13,As we watch students across Turtle Island mobilize in response to Mahmoud's illegal detention we are reminded of what Mahmoud was detained for organizing against the genocide his people and for the liberation of his homeland.
2025-04-06,guys please we need to bring more attention to what is happening in congo. an ongoing genocide being sponsored by the west and landslides caused by global warming they do not contribute to. please speak up and help!
2025-04-06,Stop Genocide stop killing of innocent people of Palistine Oic wakes up when you wake up when they attack you Be a Responsible Muslim a good Muslim.
2025-04-03,All noise to distract from the genocide they are committing.
2024-12-14,The Palestinian fight for liberation is inextricably linked to the liberation of Black and Indigenous peoples in the united states. Vassar College occupies Munsee Lenape land and continues to benefit from the genocide of Munsee Lenape peoples. Similarly the college is
2025-04-06,Total dehumanization of Palestinians is a core Zionist value. But in this moment more Zionists feel compelled to spell it out. Language is simply keeping up with genocide.
2025-04-04,Muslims literally fund the genocide with their money unknowingly
2025-04-04,Very true. Don't you think he will have more mercy for those that take action to stop the genocide as opposed to those who could have done something but did not?
2025-03-20,As the genocide continues in Gaza students remain steadfast in their solidarity with Palestine. Learn more:
2025-03-13,SIGN THE PETITION   college has suspended a student for using a MEGAPHONE to hold their admin accountable for ties to genocide. Student power will not be silenced. We will continue to fight from divestment to liberation.
2025-04-06,can you not and besides the issue of genocide in the DRC. Even after 2-3 years don t buy one.
2023-10-28,This is not a war it is a crime against humanity this is genocide. We are the voice of Palestine now. Pray for them now FREE PALESTINE!!  .FreePalestine .CeasefireNOW
2024-12-31,While the U.S. Empire and the Zionist entity increased their aggression against our families and loved ones in Gaza and across the region the Student Movement across the world stood up and fought back against their institutions' complicity in genocide.
2025-04-05,Nonsense Afghanistan is very mild compared to this stuff. Mainly because Afghanistan was an actual war and the focus was not on killing children. The footage I shared with you if pure genocide. Worth checking
2025-04-06,Criminal attack
2025-04-06,Powerful show of force to the warmongers and billionaires that the people will not be intimidated and that we will remain on the streets in defense of the Palestinian people and our collective humanity. FREE PALESTINE! End the US-backed Israeli genocide in Gaza!
2025-04-06,Hey madam. Big fan of your work. Do you care to comment on the Christian ethnostate brewing over here and the new age alt-right fascism growing across the globe or the genocide in Gaza instead of making your way through the alphabet to shit on innocent people all day?
2025-04-06,Because I vehemently oppose genocide apparently I am anti-Semitic and an extremist. It sounds crazy because it is crazy. IsraelTerroristState
2025-04-06,They even work with Israel. It's just being useless to stop genocide it's being complicit in the murder and torture of Palestinians. Shame. Shame on them. Shame on those who follow them. Would you follow evil murderers &amp;;;
2025-04-06,Do you think they will they impeach him for
2025-04-06,The demonic timeshare protection racket aka the US-backed imperial outpost colony continues its extermination campaign. To all who engaged in genocide denial: it s been documented. It won t be forgotten. We ll make sure that stink never leaves you.
2025-04-06,Israel is committing genocide in Gaza
2025-04-06,Such beautiful reassuring words;;;
2025-04-06,Just look at the devastation that RussianBarbarians have done in Ukraine.. How long will leaders of the world allow this genocide to continue? PutinIsAWarCriminal... MagaAreMorons....
2025-03-18,The genocide never ended and we will never be silenced. We continue to stand with our brothers and sisters in Gaza in the face of this continued onslaught. AllEyesOnGaza GazaUnderAttack
2025-04-06,All this so that Israel can go on with the genocide
2025-04-06,wait regardless of all that nonsense and in fact they show that they are privileged being able to go anywhere they like and its all just abt being afraid from being exposed of being isrealis while committing genocide..did you steal ya rab and weli ??? FGS!!!
2025-04-04,What's that got to do with the ummah being useless at stopping a genocide? In fact Muslim actual fund the genocide unknowingly
2025-04-06,CHICAGO: Part of the Global Strike and Protests to End the Genocide called on by Palestinian social and political institutions civil society and unions Chicago Coalition for Justice In Palestine will rally tomorrow in Little Palestine (Bridgeview) at 4:30 PM! __
2025-04-06,STOP BOMBING GAZA STOP TARGETING JOURNALISTS
2025-04-06,I think it safe to say the Celtic nations want NO PART of the English govts Genocide enablingI hate the fact that we're all tarred with the same brush under the disgusting label of the 'uk'
2025-04-06,Not true at the protest I was at there was a sea of Free Palestine flags keffiyehs and just about each speaker mentioned the genocide.
2025-04-04,A Zionist organizations cancelling someone is nothing new. Be wary of those who pay memberships to these groups who cover for genocide
2025-04-06,it s so crazy to be 5 in happiness while also committing a genocide 20 miles away
