created_at,full_text_en
2023-10-07,Reading indication for those who want to understand what is happening today and years in the occupied region of the Palestinian territory by Israel. Written by son of Jewish immigrants born in the north of the late created state of Israel. Heavy.
2025-04-06,What kind of a scum sadist is it who abuses a little girl like this? Answer: An ISIS/da'ish scum sadist of the zionist so-called free syria
2024-08-23,Iran and Hamas have taken over the Palestinian issue. A Palestinian state would mean an Iranian base in Gaza and Judea &amp;;;
2025-04-06,Psalms 119:9 BETH. Wherewithal shall a young man cleanse his way? by taking heed thereto according to thy word.
2025-04-06,1 John 3:4 Whosoever committeth sin transgresseth also the law: for sin is the transgression of the law.
2025-04-06,(Update: Hasan is said to be very critically injured in the head.) Breaking breaking: Israel assassinates the well-known Palestinian journalist and photographer Hasan Eslayeh in his tent on the grounds of Nasser Hospital in Khan Younis.
2024-05-22,
2025-03-13,For the past 13 days and during the holy month of Ramadan Israel has refused to allow the entry to any humanitarian aid into Gaza. At the same time Zionist attempts to ethnically cleanse the West Bank have intensified. This month and every month we will continue to show out
2024-08-12,Israel Adesanya s celebrations after winning the UFC undisputed middleweight title were ICONIC Will he add another title win and celebration at UFC305? Saturday 10 ET | ESPN+ PPV
2025-04-06,The Pro Israel  team in Washington D.C. our numbers small but our souls are big. Hayder
2023-10-10,Whatever we think of Benyamin Netanyahu Isral remains the only Dmocracy of the Near East Dclare Pascalpraudet YOU
2025-04-06,Horrific
2024-10-23,Palestine is a made up place invented to steal the Jewish homeland. Palestine was never a state. It doesn't exist.
2023-10-11,The Palestinian people are not Hamas. What Israel has done against Palestine does not even forgive the God they profess. The extermination of a poor nation and looted in the 21st century without the capacity to defend itself is an unimaginable crime. Palestineunderattack
2025-04-06,Im an artist from Israel and this is my song: Don't touch my khia don't touch my nachos I don't like blue cheese 'cause it is male centered If you touch my khia you're gonna have to die Start writing your farewells and saying your pmo byes
2023-11-13,Hi  this is the location of your account on the map. You are among those in the Against Israel cluster.
2023-10-15,
2025-04-06,How many mistakes is Israel allowed to make before people realize there are NO MISTAKES?!?!
2024-07-18,No. I stand with Israel. 'Palestine' doesn't exist.
2025-04-06,2-...reminiscent of the long-standing rhetorical confrontation between Israel and Iran which ultimately enabled Israel s expansionist ambitions. Turkey delivers tough talk but takes no real action like Iran while Israel continues to strike the same Syrian bases...
2024-11-22,With $7.8M in Israel-linked investments and study abroad programs at Zionist institutions this crackdown is not an aberration but a deliberate strategy to crush pro-Palestinian advocacy. National SJP demands all charges be dropped silencing dissent will not inhibit our pursuit
2024-04-10,If you're honest you'll admit that every single Palestinian Christian or otherwise lives in the State of Israel. There is no true autonomy. As for the ones in the West Bank and Gaza? Israel is exterminating them.
2025-02-21,
2025-04-06,Trump s Pick for Israel Ambassador Leads Tours That Leave Out Palestinians and Promote End of Days Theology Trump wants Gaza for real estate deals but Mike Huckabee s all-inclusive Israel tours erase Palestinians for a higher purpose.
2023-11-16,Discontinued my support for The  at the beginning of Israel's invasion due to their biased reporting. This decision seems to have been proven right once again.
2025-04-06,Good Lord !
2023-10-13,Local Pashtuns of Waziristo Paquist promised to travel to Palestine join Jihad and fight the Israeli forces. They say they are ready to sacrifice everything and do not need any support or help from anyone besides Allah. Beyond that
2024-01-21,Dricus Du Plessis called out Israel Adesanya UFC297
2024-06-03,Nope it s Israel. No such thing as palestine.
2025-04-06,Palestinian foreign ministry condemns the death of Omar Rabea calling it an extra-judicial killing amid ongoing violence in the West Bank
2025-04-06,There's a reason your culture is imploding these days and you are one of those reasons. Whether you realize it or not yet
2024-09-06,We can agree no such thing. Israel is completely in the right and the Palestinian cause is a murderous terrorist fraud driven by Islamic jihad and psychopathic Jew hatred.
2025-04-06,Menachem Begin led the Irgun a Jewish paramilitary group fighting British rule and later became Israel s PM signing the 1979 peace treaty with Egypt. Avraham Stern founded Lehi (Stern Gang) in 1940 known for radical anti-British attacks until his death in 1942. Lehi a
2024-09-03,There has to be an effort to make the US back off of support for Israel. That's clear. It's up to the students to figure out how far they have to go &amp;;;
2025-04-06,They didn't slaughter mainly children ages 0-9 in Afghanistan anywhere near Gaza. You are making things up.
2024-08-24,ISIS    Woke  ISIS
2023-11-02,30     Israel GazaStrip Palestine Us Uk
2025-04-06,Israel intentionally targeted and bombed the journalists tent in KhanYounis.
2024-07-28,2. The original Palestine is the old Perset that we call Filista in Spanish. This was only a coastal strip to the south of what is now Israel. There was an independent territory but not cohesive until the sixth century.
2024-05-13,ENCAMPMENT AT TU EINDHOVEN Students have occupied a part of TU/e campus to demand that their university cut ties with Israel. Join the students now! Bring tents sleeping material food and water Follow @ eindhoven.encampment on Instagram for updates
2025-04-06,It's normal for concentration camp inmates to hate their jailors
2025-04-06,1- Similar statements made on the same day::)) As we have noted earlier Israel and Turkey are not on the brink of war in Syria neither in the short term nor the midterm as long as Erdogan remains in power. What we are witnessing is more of a theatrical standoff ...
2025-04-06,How are they prisoners if they are innocent of crimes?
2024-02-01,No because Israel is the only country on that land. There is no Palestine. It doesn t exist and never will.
2023-11-12,I can't imagine how you as parents explain to your children if they ask why Israel can commit such atrocities with zero consequence..
2025-04-06,UK MPs DEPORTED FROM ISRAEL FOR ANTI-IDF AGENDA 2 Labour MPs from the UK Yuan Yang and Abtisam Mohamed were denied entry and deported from Israel after authorities accused them of planning to document security forces and spread anti-Israel hatred. Despite claiming they
2025-04-06,Something big is brewing in the Middle East Iran is now on high alert openly preparing for a U.S. or Israeli strike. The IRGC has taken over decision-making while rockets rain down on Israel and the Houthis declare war on the UAE. The pieces of a broader war are sliding
2025-04-06,Israeli fighter jets launch a series of airstrikes targeting the northern areas of Deir Al-Balah city central Gaza Strip following the launch of 10 rockets from there. HamasNazis
2024-06-21,Terribly irrational move. Palestine is also a puppet of Turkey which to this day denies the Armenian Genocide and would happily oppress Armenians again. Unfortunately this is also a result of Israel's policies and the strategic alliance with Azerbaijan.
2025-04-06,Imagine a government not liking what you post online so they bomb your house. That s what Israel has been doing to journalists for 550+ days straight and has killed over 211 journalists so far.
2025-04-06,Hebrew media reports that the United States has sent a third 'THAAD' battery and two 'Patriot' air defense systems to Israel.
2025-04-06,Great interview between  and ! Mentions:
2025-04-06,When Congresswoman RASHIDA TALIB tried on Thurs to classify ISRAEL as an ADVERSARY of America she was OVERWHELMINGLY DEFEATED 407 Yea 3 Nay. (What has this woman been smoking?) Per CA Congressman KEVIN KILEY (R) of CA:
2024-07-12,No matter how many times people say this it's wrong. A Palestinian state is a reward to the PA for NOT using terrorism while punishing Hamas for doing so by removing them from power. Instead Israel is punishing the PA by destroying it and making deals with Hamas.
2025-04-06,The Left will go berserk if Trump's first announced trade deal is with Israel.
2024-08-03,Israel is anything but democratic. It s a settler colonial apartheid state and everyone who claims otherwise should go back to school. Israel is the 1 problem in the Middle East. Erase the red dot!
2025-04-06,Im comparing Oct 7 footage to Gaza war footage. Duh
2024-05-01,Palsina Israel conflict concerns about 1 per thousand of humanity. That 1. May demo is completely fixed on it: possibly reality. Reason: replacement nationalism and hatred of only JD. State. For freed world society without nation anti -Semitism and racism! B0105
2024-12-03,Palestine does not exist . It is a political strategy to Islamise Israel. It is an extension of Arab colonialism. Yet the numpty supporters think they have a moral cause. They empower the hatred of Jews for this fabrication. Israel is the world s first decolonised country.
2025-04-06,Funny I used to hate Candace but her return to reality and the way her humanity shows in the face of Israel slaughtering babies children and mothers daily she s become watchable to me. Life s strange like that!
2025-04-06,Israel Leveled Gaza Then Killed the Drone Journalists Who Showed it to the World Only drones can begin to capture the scale of destruction in the Gaza Strip. The journalists doing it were targeted again and again.
2025-04-06,Tomorrow is going to interesting.
2023-10-08,Israel is not just another random state in the Middle East . It s a rogue state. An international hub of criminals. A master of subversion sabotage and manipulating Western politics. Its end would be nothing but a blessing for the West.
2025-04-06,BREAKING: Trump agreed to send a 2 million heavy bomb to Israel. The U.S will cooperate with Israel in its defence
2025-04-06,You can choose to not look at the evidence but others are not
2025-04-06,Israel is not looking for conflict with Turkey in Syria senior Israeli official says
2025-02-06,When Dricus Du Plessis shouted out Drake after his first title defense last August Drake bet $1.15M total on Sean Strickland and Israel Adesanya to defeat DDP in 2024. UFC312
2023-10-27,! Israel | aerate
2023-11-03,"The pal3stin3si, on the other hand, do not have the luxury of running away because the edges are full of soldiers ready to kill them and the only airport that had been destroyed in 2001 2002 and then 2004 from - guess who? The Isra3lians !!"
2024-08-16,An intense faceoff between Dricus Du Plessis and Israel Adesanya UFC305 | Saturday 10 ET | ESPN+ PPV   (via )
2025-04-06,Is Trump negotiating? Israel dropped tariffs on the US to 0 before April 2 still on the list at 17%. Vietnam is dropping all tariffs still on the list. We have an exhaustive free trade agreement *Trump* signed with with his good friend Abe in Japan a few years ago Trump said
2025-04-06,The nice thing is you can verify the claim.
2025-04-06,Doesn't make him any less of a criminal
2025-04-06,No it's not Israel it's Muslims.. It's not even Muslims it's really Islam that is the danger it's a fake religion disguised as a religion but an imperial lethal force of destruction like every country they have conquered
2024-06-26,REVIVE THE BOYCOTT MOVEMENT In the early years of Al Nakba the Arab League's boycott pressured the US to limit arms supply to Israel. It's time to reinvigorate a comprehensive global boycott and hold these financial institutions accountable.
2025-04-06,i personally know the grandchild of a jewish woman that was imprisoned in the holocaust. she owns a star of david that belonged to her grandmother that got her through the camps. notably PRE israel. it has been a symbol of jewish strength and israel does not get to co opt it now
2024-06-22,June 18 marked the commencement of the 56th session of the Human Rights Council. The same UN experts monitoring Israel s brutal occupation and genocide in Gaza are now looking into the human rights violations of US college students for protesting that genocide. We will not be
2025-04-06,The Gulf dictatorships have finally realised they mightn't survive collaboration with Israel and the US. War with Iran is gonna trigger popular uprisings against pro western regimes across the Middle East. America and Israel have already lost.
2024-08-17,Dricus Du Plessis defends his middleweight title against former champion Israel Adesanya and a clash between flyweight contenders Kai Kara-France and Steve Erceg headline UFC305 Saturday 10 ET on ESPN+ PPV
2023-12-14,The letters on the table: Israel does not want the solution of two states. He wants one of his from the Red to the sea. With the land of Palestine but without its population.
2025-03-18,Over the past two months the Zionist state of Israel has continually violated the provisions of the ceasefire agreement acting with impunity and the full backing of the imperialist Western world. Now the Zionist entity is continuing the genocidal bombardment of the Gaza Strip
2025-04-06,Regarding U.S. aid to Israel: Trump's first term (2017 2021) provided ~$14.4B mostly regular military aid. Biden s term (2021 2025) gave ~$33.1B including $15.2B regular and $17.9B emergency aid due to conflicts. Trump s current term (2025 now) has seen minimal aid so far.
2025-04-06,There's a reason your posts get no likes and you have no followers. One day you'll realize what that reason is
2025-04-06,I've been speaking up for Palestinians for 30 years But Hamas is a major PROBLEM for Palestinians Hamas went to Israel and KIDNAPPED women children and elderly people and took them back to Gaza And Hamas evil actions caused Gaza to be bombed and destroyed
2025-04-06,It's pretty accurate even he knows
2024-05-13,Jonathan: Free free Palestine! Sumayyah: Over 40 000 Palestinians killed by Israel. Say what: Free free Palestine!
2025-04-06,Gaza Rockets Strike Ashkelon Intercepted by Iron Dome. Approximately 10 rockets were launched from the Gaza Strip towards southern Israel targeting cities such as Ashkelon and Ashdod. The Israel Defense Forces reported that most
2024-05-12,Demands from the Duke students flyer: We call on Duke to DISCLOSE its financial investments in Israel DIVEST from companies profiting from the occupation of Palestine BOYCOTT academic partnerships with Israeli universities and SPEAK in favor of an immediate ceasefire.
2023-10-07,I am reading and talking to those who live in the region the Palestinians attacked Israel in a cowardly manner shot the elderly at the bus points entered homes and shot Famlias kidnapped old people and now was advertising Barbarie that
2023-10-15,War criminals. The Israel army order 1 1 million Palestinians who left their homes and then mata many of them while trying to follow that impossible order.
2025-04-06,Israel found out these two. They did the right thing in banning them from their country. Sense prevails even though it s not in my own country! Furious row after Labour MPs denied entry to Israel
2024-08-17,Drake is betting on Israel Adesanya to win at UFC305 TONIGHT 10 ET on ESPN+ PPV
2025-04-06,Tough call but if you re prioritizing a pro-Israel stance Labour s your best bet right now. They re in power with a clear support for Israel s defense led by Starmer. Conservatives are solid too historically pro-Israel but they re in opposition and lagging at 22% in polls.
2025-04-06,LOW BLOW: Israel BOMBS Paramedics and Rescue Workers!
2025-04-06,Yes the territory now called Israel was historically named Israel during the ancient Kingdom of Israel (1047 722 BCE) though its borders differed from today s. After its fall the region was called Judaea Palestine and other names until 1948 when the modern state revived
2025-04-06,I love how there's literally no Hamas in the video
2024-07-21,There is no state of Palsina There is a piling up by the radical Islamic Hamas.
2025-04-06,I have not jumped on the bandwagon to condemn Israel for firing on the ambulances and unmarked vans and paramedics along with men in civilian clothing with automatic weapons because Hamas has a very long history of Al Qassam soldiers doubling as paramedics and using ambulances to
2025-04-06,It is not. Israel has a law denying entry to people who call publically for its destruction and boycott . Sovereign countries are free to decide who they allow in.
2025-04-06,They lied as they usually do. Is anyone surprised?
2024-05-26,Friendly reminder that just like the tooth fairy there is no such thing as Palestine. Never has been and never will be.
2025-04-06,The Greatest Movie Trivia (601): The bulk of the picture was shot in Israel and director Samuel Fuller remarked that it was unsettling after a scene was shot when the German soldiers and SS troops would take off their helmets and Fuller would see them wearing yarmulkes.
2024-08-24,Exactly. His supporters (which transformed into PraGib supporters during the presidential campaign) even slammed Ganjar's refusal of World Cup U-21 that would feature Israel. Disgusting.
2024-12-26,The term Palestine refers to the plan by the Arab-Muslim world to establish an apartheid Arab-state in the Holy land where Jews won t be allowed to exist. When you recognize Palestine as a state you actually support the ethnic cleaning of Jews from their homeland.
2023-11-23,The Zionist counter was on the Raced Rland Bara on Palestine.
2025-04-06,Nothing scares Israel more than the camera and the truth. Since the ceasefire they ramped up their targeting of journalists and today the targeting of a tent where journalists gather near the Nasser Hospital.
2025-04-06,Russia attacking Ukraine from the Black Sea in defiance of the maritime ceasefire Trump claims to have brokered. HamasISIS launching rockets into Israel after refusing to release the hostages during a Trump-brokered ceasefire. The Khomeinist regime in Iran and
2024-08-08,Israel torture and kills the Palestinian prisoners Israel kills Palestinian children Israel Bombarda Hospitals Schools and Universities and humanitarian offices Israel wants the extinction of the Palestinians Israel a terrorist state who supports them accomplice Sionismonovonazismismo
2024-01-04,Israel practicing a genocide in Palestine since October and the Daesh revives in the area attacking Irn. No one expected less from Mosad.
2025-04-06,The War of Rebirth is Netanyahu's term for Israel's current multi-front conflict framing it as a pivotal moment for national renewal echoing the 1948 War of Independence. It ties to the War of 7 Fronts Hamas Hezbollah Houthis West Bank terrorists Iraqi/Syrian militias
2024-02-03,'Palestine' is from the Hebrew root  (Palash) which means 'invader'. Also I'm pretty sure there's no 'P' in Arabic which makes it even weirder.
2025-04-06,Palestinian militant group Hamas said it fired a barrage of rockets at cities in Israel's south on Sunday in response to Israeli massacres of civilians in Gaza. Click the photo to read more:
2025-04-06,What now . Or will you be issuing your standard 'we're waiting on the result of the investigation being carried out by Israel'. I hope and pray you end up at the Hague as a co-conspiritor...
2023-11-20,let me add that In Arabic there is indeed no direct equivalent to the letter P. The name Palestine in Arabic is written as  (Filastin) using the Arabic letter  (Fa) to approximate the P sound.
2024-11-08,But you're silent crying. The only two -states solution with Palestine 1 and Palestine 2. Let's not joke a genocidal messianic regime must not exist. Israelis as people must learn equality and respect for human life (those who will not be tried to
2024-03-31,"There is no + there was never a country of Palsina. There is a geogr. Palsina area lived in by Jews +Arabs. According to the UN, this should be shared into two states, which the Arabs did not want. They formed an Israel to destroy. Result: sentence 1."
2025-04-06,Besides it's been downloaded even by Israeli media outlets and reported on.. if it was malicious you don't think someone would have mentioned something?
2023-11-20,Palestine has the support of the world behind it it shall never crumble
2025-04-06,No source? Just some blurry images? The last one is a civil defense uniform lol
2023-11-14,I understand your Irona but it's just that Irona. Your passport will not register an income to Palestine if you travel to Israel. Empling that it is as frustrating (for you) as true.
2024-05-16,It was called Palestine for 2 000 years as it is a Roman term. Not a state of Palestine. That has never existed. you don't even have the letter P in the Arabic language. Jews were called Palestinians before 1948. Palestine Post newspaper - Jewish Palestine soccer
2025-04-06,Ain Media also employed Gazan journalist Ibrahim Lafi who was killed on 10/7 at Erez Crossing which Hamas breached in order to kill Israelis throughout southern Israel. No mere journalist was at Erez Crossing on 10/7. Only participants. Terrorists.
2023-11-15,Not in response Israel is determined to end all the Palestinians and occupy their territory to finally fulfill the sionist dream from the Red to the sea better do it well
2023-10-07,By supporting the Palestinian terrorists instrumental by corrupt extremely corrupt parties such as Hamas and Hezbollah you in fact prcipite the pure and simple disappearance of the Palestinian nation.
2024-05-30,What is All eyes on Rafah  mean? Rafah is in crisis. After 236 days of suffering Palestinians were forced to flee their homes for makeshift tents in Rafah promised as a 'safe zone' by Israel but even there they face brutal attacks.
2024-05-28,ALL EYES ON RAFAH
2025-04-06,Forget Rafah or Khan Younis or Gaza City. Those places are terrorist bases and nothing more. But why are there NO eyes on the Christians being systematically slaughtered by Islamists every day? Nobody seems to even care about the victims of Islam. I wonder why that is?
2025-04-06,Rafah existed for over 3 300 years. It was wiped off the map by a settler-colony that has existed for just 77 years.
2024-06-01,REVOLT FOR RAFAH Join Palestinian students supported by the wider community at Columbia at a the new Gaza Solidarity Encampment. We are outraged by Columbia s complicity in the killing of our people in Gaza and most recently the massacre in Rafah. We are equally outraged
2024-05-29,Pagi guys ayo tetep naikin ht ALL EYES ON RAFAH ALL EYES ON RAFAH ALL EYES ON RAFAH ALL EYES ON RAFAH ALL EYES ON RAFAH ALL EYES ON RAFAH .. RafahUnderAttack .. GazaGenocide .. AllEyesOnRaffah
2024-05-26,ALL EYES ON RAFAH
2024-05-28,all out for Rafah
2025-04-06,An Israeli tank platoon lined up outside a school in Rafah which once sheltered displaced Palestinian families and unleashed a barrage of shells and indiscriminate gunfire on the building ensuring civilians could no longer seek refuge there.
2024-05-27,Milan Italy University of Milan blocked by Palestinian encampment for Rafah today
2024-05-28,Selamat pagi ayoo terus naikan ht ALL EYES ON RAFAH ALL EYES ON RAFAH ALL EYES ON RAFAH ALL EYES ON RAFAH ALL EYES ON RAFAH ALL EYES ON RAFAH . RafahUnderAttack . GazaGenocide . AllEyesOnRaffah
2025-04-06,Forgive me mum. I swear I only accepted this path to help people. O Lord accept my repentance. These were the final words of Palestinian paramedic Refaat Radwan before he was executed by Israeli forces in Rafah along with 14 colleagues. Gaza
2025-04-06,Rafah still exists
2025-04-06,i need a rap verse pLEASE
2025-04-06,Released footage from the Israeli army documents the detonation of Palestinian homes with voices of jubilation clearly heard in the background north of Rafah in southern Gaza. Israel is a rogue colonial occupying terrorist genocidal state.
2025-04-06,Rafah has been wiped off the map no homes no trees no life left You once said All eyes on Rafah. Now will you look away?
2025-04-06,Rifaat Radwan was a Palestinian paramedic working for the Palestinian Red Crescent Society (PRCS) . On March 23 2025 while responding to an airstrike in the Tel al-Sultan neighborhood of Rafah in southern Gaza he was killed along with 14 other rescuers by
2024-05-11,Hiroshima In an act of anti-imperial solidarity heard round the world students and workers in Hiroshima marched in opposition to the zionist invasion of Rafah today.
2025-04-06,No Rafah anymore!
2025-04-06,After Israel violated the Peace Treaty in May 2024 Egypt decided to deploy hundreds of tanks APCs anti-aircraft systems and artillery into Sinai particularly in the Egyptian City of Rafah which is located within Zone C as outlined in the treaty's security annex.
2024-05-06,the Student Intifada has swept the UK ALL OUT FOR RAFAH! ALL OUT FOR DIVESTMENT!
2025-04-06,A fine line separates being and nothingness. Rafah was. It is no more. Being fades before annihilation. Israel justifies its genocide through the defense of being of abstraction. The politics of bearing witness must begin with living. Palestinians live. Their lives are precious.
2025-04-06,Spokesperson for the Palestine Red Crescent Society says PRCS is calling for an independent international investigation to ensure justice for the 15 rescue workers executed by Israel in Rafah on March 23. The assault on was not an isolated incident it is part of a systematic
2025-04-06,Queues of food and aid trucks abandoned on the Egyptian side of Rafah. Israel has imposed a total blockade on Gaza for over a month.
