created_at,full_text_en
2025-04-06,Jewish Americans like me who are highly critical of Israel: the administration is saying that there are good Jews and bad Jews! And good Jews are the ones who support Israel's actions in Gaza. And bad Jews are the people like me. We are suddenly at the center of politics of
2025-04-06,The real terrorists  Yemeni Gaza Perfect10Liners TrumpTariffs Gaza_Genocide
2025-04-06,If anybody needs a chip inserted in their brain named FAFO is Satanyahuhu ..Trump should order Elon to implant one with no delays in his sick mind so the Gaza killing stops.
2025-04-06,Is anyone surprised by this? Iranians have been telling the world for years that the terrorist Islamic Regime occupying them sends billions to Hamas terrorists. Iranians inside Iran shout No to Gaza! No to Lebanon! My life for Iran! because they are sick and tired of their
2025-04-06,Gaza and Hamas: we're winning the war against Israel. Does this video look like winning to you?
2025-04-06,Katil Srail Gaza Gazaholocaust Gazagenocide
2025-04-06,BREAKING: Reports confirm the death of General John Pagri Commander of the Special Tasks Battalion in the U.S. Army in the Gaza Strip.
2025-04-06,I just pledged my support to  for justice dignity and peace in Gaza. Join me in standing with the people of Palestine to help them rebuild their lives and futures. Add your voice today:  StandWithGaza JusticeForGaza
2025-04-06,Not taking a position on Gaza is taking a position on Gaza. One you ll have to live with for the rest of your life.
2025-04-06,We failed them. Shame on usGaza GazaHolocaust GazaGenocide
2025-04-06,The children of Gaza stand as proof of a world that looked away. Dont look away.
2025-04-06,Thank you  for your reporting on the atrocities occurring in our world. The world needs to know the true stories! Gaza innocentmigrants prayingforjustice
2025-04-06,I just donated to a family in Gaza struggling to survive the war. Every little bit helps them get food and water. Please consider helping too. Share and donate if you can!! One Love Free free Pale/stine Free free Ga/za!! &lt;3 &lt;3 &lt;3
2025-04-06,Ousman Noor | INSTRUCTIONS: HOW TO STOP GAZA GENOCIDE We've launched a campaign to estbalish an international armed force to stop the Gaza Genocide. We... | Instagram
2025-04-06,Reminder to myself If I feel life is hard please remember there are people in Gaza suffering more than me. I still stand until today because God s mercy not because my power or resilience. I m weak and that s me because I m human.
2025-01-25,To mark International Education Day  has released a short film Our Universities Live On: Testimonials of Hope created in collaboration with students and academics in Gaza. Despite over 400 days of destruction displacement and siege they continue to fight for their
2025-04-06,His name is Hamza Abu Issa
2025-04-06,Just couldn t vote for Kamala- something about the sound of her laughter. She warned you! stockmarketcrash Crypto MAGA Trump NFL NHL MLB FinalFour WorldCup tarrifs Veterans hurricane earthquake tornado Russia Gaza Houthi Yemen
2025-01-20,Suspension for Gaza is the highest honor! repost from  on instagram
2025-04-06,Hamas launches missiles from Gaza. Time to finally level the damn place.
2025-04-06,Please don't stop talking about Gaza
2025-04-06,Russia was always guaranteed to win Trump TrumpTariffs zelena LIVEVE Munster Gaza garnacho MUFC
2025-04-06,EU sucks 100% Russia is good at developing MUFC Garnacho Gaza Dorgu
2025-04-06,We are dying of hunger We are dying of hunger We are dying of hunger We are dying of hunger We are dying of hunger We are dying of hunger We are dying of hunger We are dying of hunger We are dying of hunger
2025-04-06,most of the Gaza protestors are:
2025-04-06,Abdel Hadi the President of Palestine's Children Council - Gaza Strip
2025-04-06,Salute to the courage of this lady for expressing herself in this big forum at Microsoft. IsraeliWarCrimes Gaza GazaHolocaust
2025-04-06,The IDF Crimes Against Humanity. StopTradeWithSettlements EndIsraeliImpunity SanctionIsrael AparthiedIsrael IsraeliNewNazism StopArmingIsrael IsraelTerroristState EndZionism StopArmingIsraelNOW UNseatIsrael FreePalestine Gaza GazaGenocide GazaHolocaust
2025-04-06,Stop the holocaust in Gaza
2025-04-06,Stop the world for Gaza!
2025-04-06,Documentation from the moment of the fall in the city of Ashkelon. IsraelUnderFire Gaza
2025-04-06,Help Obada's family escape from gaza war and reclaim their lives. Please support this GoFundMe by donating or sharing every bit of help makes a difference.
2025-04-06,I was able to match the last $10 for 's new campaign - can anyone else do the same? He had to leave his family behind in Gaza when he finally got the chance of medical evacuation for his own severe injuries - please help him to make sure they're provided for.
2025-04-06,MOROCCO - Rabat for a FreePalestine and stop Gaza genocide
2025-02-27,BBC finds serious flaws in making of Gaza documentary and says there are no plans to air it again in current form
2025-03-18,At least 330 people killed in Israeli air strikes on Gaza says Hamas-run Gaza health ministry Follow live
2025-04-06,All they do is lie: The Palestinian Info Center which has half a million followers on Facebook has posted a photo of actress Katherine Heigl who played Dr. Izzie Stevens in Grey s Anatomy identifying her as a French doctor who has traveled to Gaza to offer medical help.
2025-04-06,America is already directly responsible for genocide in Gaza. If we have combat troops on the ground there our nation has crossed the Rubicon.
2025-04-06,Stop the Genocide_in_Gaza please
2025-04-06,Enemy_Media Uri an Ashkelon resident whose house was hit by shrapnel says: - A year and a half after the war in Gaza rockets are still falling on Ashkelon - this is not real and it is not normal. - He added after taking this video: We don't feel victorious.
2025-04-06,Qaza  Gaza is the city of resilience and patience.
2025-04-06,Mike Mihajlovic emphasizes that the expenses of Israel s genocidal war on Gaza are mainly covered by the US Congress. Watch in full EconomicDivide
2025-04-06,57 countries exposed by Gaza Genocide
2025-04-06,Please help Oday and his family by donating and sharing
2025-04-06,Israeli warplanes targeted a tent used by journalists near Nasser Hospital in Khan Yunis Gaza.
2025-04-06,This is the prominent leader targeted by American aircraft: the martyr Sarim Ibn Sheikh Saleh Al-Suhaili. One of the martyrs of the American aggression on their home in the Saawan area of Sana'a. The children of Yemen are no less important than the children of Gaza. _
2025-04-02,Israel says it is expanding its military operation in Gaza and will seize large areas of the territory
2025-04-06,People have no idea how tiny of a strip Gaza is &amp; dropping 6 hiroshima bombs on it is meant to annihilate every single living thing in it &amp; the Arab world has/ is letting it happen &amp; the harsh truth is it doesn't even guarantee stability more destruction to come. Ya Allah
2025-04-06,WARNING: GRAPHIC 18+ Israeli warplanes have targeted a tent used by journalists near Nasser Hospital in Khan Yunis Gaza. GazaHolocaust GazaGenocide
2025-04-06,The lefter-than-thous who demanded that the 2024 election be a referendum on the Biden admin s handling of Gaza really should have considered that helping elect Trump to do Gaz-a-Lago would decenter their Omnicause for the foreseeable future and perhaps permanently
2024-12-14,from Vassar SJP on IG: Early this morning a group of autonomous actors tagged Vassar College a neoliberal corporation manufacturing consent for and investing in israel's ongoing genocide in Gaza the occupation of the West Bank and the recent zionist escalations in Lebanon
2025-01-16,STUDENTS: MOBILIZE THIS TUESDAY JANUARY 21ST On Wednesday January 15th a ceasefire was established in Gaza; a demand championed by the Palestinian people and their billions of international supporters. We know that our work is not over it has just begun. A ceasefire
2025-04-04,I think the issue with Indians is their ignorance. For instance most think that Kashmir is horrific where around 300-400 children died but don't think Gaza is a genocide where 20 000 children have been killed and where Israel mainly kills children ages 0-9. Not adults.
2025-01-15,Today January 15 a ceasefire ends 15 months of israel's horrific genocide in Gaza. Today Palestinians celebrate with those around them; those who survived extermination starvation torture who defied death and carried the torch of Palestinian freedom onward.
2025-04-06,Kids in Gaza aren t asking for justice. They re asking for water. For light. For a night without drones overhead. If that doesn t haunt you you re not paying attention.
2025-04-06,The slaughter of children in Gaza passed her by
2025-04-06,'We don't have water to drink. We need your support to provide water for us'. 's campaign has received no support at all for the last two days - please help her and her three young children:
2025-01-21,Harvard s response to the genocide in Gaza:
2025-01-20,from  on IG: Last week Columbia held 22 disciplinary hearings against alleged student protestors from the Gaza Solidarity Encampment. During their hearings students spoke bravely about their commitment to fighting towards a free Palestine and forced the University
2025-04-06,The medical director at Al-Ahli Hospital in Gaza Doctor Fadel Naim warned that the situation has spiralled completely out of control in the hospital. With Gaza s health system in collapse hospitals are overwhelmed;doctors are forced to make agonising choices about who receives
2025-04-06,The world failed Gaza. Palestine. We will never forgive never forget. If someone says one bad thing about Hitler after all of this. he just should act earlier maybe there was a chance. With all respect to normal jews. Zionists are not humans not animals. They re hell on Earth
2025-04-06,:(( My account has been restricted so my gfm doesn't appear to everyone! Please support my family s gfm!! by sharing quoting and donating. Please leave a comment  or even a dot.
2024-11-23,from SPHR at Concordia University where 11 000 students went on strike for Gaza this week
2024-12-04,repost from CCNY SJP on IG: On The National University Day of Strike every CUNY campus took to the streets converging at CUNY central to demands that CUNY DIVESTS! Students have been and will continue to keep up the fight for divestment because EVERY SINGLE UNIVERSITY IN GAZA
2024-11-28,UPDATES FROM DAR WADEE AL FAYOUMI ENCAMPMENT AT SARAH LAWRENCE COLLEGE: Thank you to every single person who sustained the fight on campus in solidarity with Gaza and Palestine this week. This is only the beginning.
2024-12-08,Last Thursday Boulder SJP took back the University Memorial Center to show solidarity with Gaza. Meanwhile the administration continues to prioritize its commitment war contractors. Two students were banned from campus for two months without any resolution and Boulder SJP has
2024-12-07,But the fight is far from over. As the humanitarian crisis in Gaza worsens UlC must actively work to incorporate the Palestinian perspective into its programs and partnerships. The School of Public Health cannot claim to stand for equity and social justice without addressing the
2025-03-18,After two weeks of a brutal siege which denied Palestinians life-saving humanitarian aid and drone strikes that have killed dozens the Israeli Occupation forces have renewed their escalated bombardment of Gaza and announced a total collapse of the ceasefire. AllEyesOnGaza
2025-04-06,Powerful show of force to the warmongers and billionaires that the people will not be intimidated and that we will remain on the streets in defense of the Palestinian people and our collective humanity. FREE PALESTINE! End the US-backed Israeli genocide in Gaza!
2025-04-06,what an idiot you are  was Hamas occupying Israel or Israel occupying Gaza and the West Bank - you Christian Zionists were butchering Jews when Hitler was around - you just changed your victims but you are racist scum underneath
2025-04-06,Threats to Israeli/U.S. Interests - HIGH threat level  White House: Trump blames Hamas for aid worker deaths in Gaza IDF strikes. NSC spokesperson: Trump understands Hamas' use of ambulances and human shields creates 'impossible situation' for IDF. Hamas TerroristTactics
2025-04-06,Notice how the racist Chabad princess makes sure to use the photo that associates Khalil (Gaza) with the supposedly deranged libtard (But the most retarded part is thinking '86' means to kill lol)
2025-04-05,Except they were and some were even UN staff. This is normal in Gaza
2025-01-15,We the Student Movement for Palestinian Liberation commit to the fight ahead. We will not rest until we achieve divestment secure an arms embargo and end the siege on Gaza.
2025-04-06,There is a massacre in Gaza!!! RafafOnFre   GazaGenocide Gaza GazaHolocaust FreePalestine
2025-04-04,That's totally not true. It's almost exclusively children ages 0-9. The real Islamists are even in Gaza
2025-04-06,There is a journalist burning on fucking live feed in Gaza right now and of course this is supposed to be normal.
2025-04-06,Israel's military changed its initial account over last month's killing of 15 emergency workers in Gaza which has sparked calls for an independent investigation
2025-04-06,Those in Gaza who aren t directly bombed by Israel are being starved to death as Israel prevents humanitarian aid to get through.
2024-11-21,Sarah Lawrence College NY TAKE A BUILDING CHALLENGE UNDERWAY: An autonomous group of students have started a Gaza Solidarity Occupation in Westlands calling on the college to DISCLOSE their financial investments &amp; DIVEST FROM DEATH. Show out to South Lawn today to support!
2025-04-06,Iran's IRGC releases a Threatening &amp; Intimidating AI Video! CrippleALI Has Spent Over $350bn to Support Terrorists &amp; Rogue Regimes In Somalia Syria Lebanon Gaza Yemen JS &amp; Iraq. Russia Ukraine US France Canada Germany England Israel Egypt Turkey Qatar
2024-10-07,The American University in Cairo Today a year into the genocide in Gaza AUC students climbed to the rooftop of the SSE building during assembly hour to raise two banners so all campus could see. The 1st banner reads: ONE YEAR OF GENOCIDE The 2nd reads: Today it's
2024-11-22,from our Sarah Lawrence comrades: SHAME! On Day 2 of our Gaza Solidarity Encampment Sarah Lawrence Campus Safety officers inspected the tents of students and imposed unfair ID checks on our students and campus community.  FREE PALESTINE LONG LIVE DAR AL-FAYOUMI GLORY TO
2025-04-06,Global strike out FreePalestine StopGenocideInGaza Gaza strike GlobalStrikeForGaza
2025-04-06,Free Phalastna Free Gaza.
2024-11-21,ALL OUT TO SARAH LAWRENCE COLLEGE! DEFEND THE STUDENT INTIFADA! For over 400 days our institutions have ignored the genocide of our people in Gaza we DEMAND that they disclose their financial investments and they DIVEST FROM DEATH Rally to Demand Disclosure Divestment
2024-10-17,Chag Sukkot Sameach! Scenes from Gaza solidarity sukkahs across the country Pictured here in order: Brown Northwestern UChicago and Columbia
2025-04-06,Undersecretary of the Ministry of Health in Gaza: During the war 52 deaths among children were recorded due to malnutrition and we are facing new numbers unless food supplies are allowed in.*
2025-04-06,warning don't watch this if easily upset. Last Mayor of Gaza tells what Hamas is like compared to ISIS.
2025-04-06,International calls for a global strike on Monday April 7 in solidarity with Gaza and in rejection of the ongoing Israeli massacres against Palestinians.
2025-04-06,Israel is committing genocide in Gaza
2024-12-31,While the U.S. Empire and the Zionist entity increased their aggression against our families and loved ones in Gaza and across the region the Student Movement across the world stood up and fought back against their institutions' complicity in genocide.
2025-04-06,After incitement by Israeli media calling for his death journalist Hassan Salih was targeted in an assassination attempt by Nazi Israel.
2025-04-06,Hey madam. Big fan of your work. Do you care to comment on the Christian ethnostate brewing over here and the new age alt-right fascism growing across the globe or the genocide in Gaza instead of making your way through the alphabet to shit on innocent people all day?
2024-11-15,Tufts has bent to the zionist donors of this school but its students will not. We are asking the students of this university to hear the cry of Gaza and re-commit themselves for the fight towards divestment. Together we will help create a free Palestine within our lifetimes.
2025-03-12,While the US ramps up its militaristic repression at home it is enabling the Zionist entity in cutting off electricity to Gaza. This is what Mahmoud was protesting against. American fascism and Zionism go hand in hand.
2025-04-06,May they experience the same God willing. May the bodies that lie beneath the rubble haunt those bulldozing &amp; ethnically cleansing Gaza IsraeliWarCrimes StopGenocideInGaza FreePalestine
2025-03-05,US has held direct talks with Hamas over Israeli hostages in Gaza White House confirms
2025-02-20,Hamas is handing over the first bodies of Israeli hostages held in Gaza Follow updates:
2025-04-06,When massacre of Muslims taking place in Gaza I'm horrifying to read Muslim priorities other then this on social media please voice for this unlawful killings in GAZZA
2025-01-20,Sanctions for the Gaza Solidarity Encampment are set to come out within the next few days. Hind's Hall disciplinary hearings begin next week. We must pressure Columbia to drop ALL sanctions and dismiss all charges against pro-Palestine protestors before final decisions are made.
2025-01-17,If the destruction of libraries universities and archives in Gaza is not in the interest of history what is?  AHA members: cancel your memberships. An institution that turns its back on education cannot pretend to serve history.
2025-04-06,Fvck Pershing Square KINCAP shorts equities LOOOOOOWWWWWWEEEEERRRRR Disgustingly So Lower than your worst nightmare Gaza Mode
2025-04-06,While Gaza is drowning in bloodshed
2025-04-06,Don t stop talking about Gaza
2025-04-06,Gaza GazaGenocide GazaHolocaust How much longer will the rest of the World allow Israel to get away with this?
2025-04-06,URGENT To all residents of Gaza present in the Deir al-Balah area in the neighborhoods: Al-Sahaba Al-Samah Al-Awda Al-Zawaida and Al-Salah This is a final advance warning before the attack! For your safety you must move immediately south to the known shelters in
2025-04-04,The footage from Gaza is several order of magnitude worse than the footage of the holocaust Vietnam and even Dresden combined.
2025-04-06,Everyone already knew Trump s position on Gaza. The bad part is that the Kamala s position was no different.
2025-04-06,Sincerest apologies to this person for having to deal with the (hypothetical?) problem of explaining to their kids what 'shit rentals' and 'pingers' are (although with what's going on in Gaza you might think there are some more challenging things to explain to kids rn than that?)
2025-04-06,BREAKING Egypt closed the Rafah crossing gate on the Egyptian side of Gaza Strip with a long concrete wall
2025-04-06,I might be the next martyr This is our reality this is the voice of Gaza. How long will this nightmare last?
2025-04-06,Israeli airstrikes kill 44 Palestinians in Gaza
2025-01-19,As the ceasefire begins we honor the incredible resilience and sacrifice of the people of Gaza. Let s continue to support mutual aid efforts and organize to eradicate Zionism on our campuses. Our work has only just begun.
2025-04-06,An Israeli bombardment on a group of Gazans in the Al Tuffah neighborhood northeast of Gaza left 11 dead including nine children according to the enclave s civil defense and Palestinian media via Telegram.
2025-03-20,As the genocide continues in Gaza students remain steadfast in their solidarity with Palestine. Learn more:
2023-10-14,Between Jakarta's poor air quality my allergies and continuous horrific updates about war crime in Gaza I didn't get much sleep last night. Other than praying donating and amplifying the underreported ground truth what else can we do? PalestineGenocide
2024-12-17,The Israeli air and ground strikes on Gaza have resulted in over 50 deaths including children a cameraman from Al Jazeera and Civil Defence personnel. The casualties reflect the ongoing violence in the region.
2025-04-06,Shout out to Karachi merchants striking for Gaza while we host Netanyahu in Washington.
2025-04-06,Hamza Abu Issa Another beautiful child from Gaza beheaded by IDF airstrikes using U.S.-made bombs adding to the ongoing massacre of over 30 000 children killed by sophisticated weapons in plain view of the world.
2025-04-06,Only two scenarios will come out of this meeting. It s either Trump will force Netanyahu to end the war in Gaza or they will make a decision on possibly bombing Iran later this week.
2025-04-06,Sadly they cannot trust anyone in Gaza so I don t blame them for rather safe than sorry situation.
2025-01-25,95% of Gaza's schools have been destroyed. Youth already deprived of 3 years of education due to COVID-19 and war now face a 30% drop in future earnings. This isn t just an attack on education it s an attack on an entire generation s future.
2025-04-06,They've made Gaza a death trap both physically and mentally
2025-04-05,It is standard procedure for IDF. Medics and civil service journalist and police in Gaza are true heroes that will never have Hollywood movies made about them.
2025-04-06,Gaza Israel killed a mother and her three daughters in an Israeli raid in the south of the Gaza Strip. By bombing their tent
2025-04-06,BubbaNews: I m not sure what s going on here. Egypt tonight just closed the Rafah crossing gate on the Egyptian side of Gaza Strip with a long concrete wall. Something doesn t add up.
2025-04-06,REP. AL GREEN VOWS TO IMPEACH TRUMP WITHIN 30 DAYS OVER GAZA REMARKS Rep. Al Green (D-TX) declared he will introduce articles of impeachment against Trump within the next 30 days accusing him of being unfit for office and citing his controversial Gaza comments as
2025-04-06,I have shared news of Israeli war crimes &amp; CrimesAgainstHumanity since 2012 12 years before you started posting on X - in fact I witnessed them first hand when I lived in Gaza. And I will continue to share Israeli CrimesAgainstHumanity until Israeli criminals are executed.
2025-04-06,A MAN BEING BURNT ALIVE AFTER BEING BOMBED BY ISRAEL GazaHolocaust GazaGenocide Gaza
2025-01-28,Please donate to and share the BRISMES Fund for Higher Education in Gaza an initiative to help support the reconstruction of higher education in Gaza in accordance with the declared priorities of the Emergency Committee of Universities in Gaza
2025-04-06,Is This The World We Created?  It is all a part of the same phenomenon. Western governments actively assisting genocide in Gaza; attacks on benefits for the disabled; a deliberate official narrative of Russophobia; rampant Islamophobia boosting the rise
2025-04-06,The fact that people really seem to think there's a lot of daylight between the trump and Biden policy on Gaza is actually insane.
2025-03-13,For the past 13 days and during the holy month of Ramadan Israel has refused to allow the entry to any humanitarian aid into Gaza. At the same time Zionist attempts to ethnically cleanse the West Bank have intensified. This month and every month we will continue to show out
2025-04-06,The news from Gaza is utterly horrific. From the West Bank too. And from Lebanon. The over militarisation of any country leads inevitably to invasions and then to world conflict. Is this what those who support the above want? Is that what you voted for in the UK and US?
2025-04-06,I've been speaking up for Palestinians for 30 years But Hamas is a major PROBLEM for Palestinians Hamas went to Israel and KIDNAPPED women children and elderly people and took them back to Gaza And Hamas evil actions caused Gaza to be bombed and destroyed
2025-03-18,Israel announces extensive air strikes on targets in the Gaza Strip the largest attack since January s ceasefire came into effect
2025-04-06,Another Journalist in Gaza
2025-02-08,Three Israeli hostages handed over by Hamas in Gaza as more Palestinian prisoners to be freed under ceasefire deal - follow live
2025-04-06,Tens of thousands of Moroccans have taken to the streets to protest against Israel s punishing assault on Gaza and its people also directing their anger at the United States and its support for the 18-month-long war despite Israeli war crimes.
2025-03-18,Israel's Prime Minister Benjamin Netanyahu says Israel has resumed combat with full force after deadly Gaza strikes adding this is just the beginning Follow live:
2025-03-23,The number of Palestinians killed by Israel in Gaza surpasses 50 000 says the Hamas-run health ministry
2025-04-05,There is no 'war' going on in Gaza.
2025-04-06,Civilians from Gaza invaded Israel along with Hamas to rape murder and kidnap Jews. October 7 2023
2025-04-04,I know. I can try to explain my thoughts. Everything Zionists and Jews have touched is coming into question. Israel with the help of the media is really fucking up the fabric of society and Gaza is having ripple effects in every corner of then planet. This will not end well
2025-04-06,How was their operational security prior to all those pagers detonating the next day when the ICOM's went boom when Nasrallah went see Allah or during the HR Ops in Gaza? You used a crap example got called on it publicly and are struggling to validate it.
2025-04-06,STOP BOMBING GAZA STOP TARGETING JOURNALISTS
2025-04-06,BREAKING: A Palestinian journalist reports that Israeli forces directly struck the journalists tent at Nasser Hospital in Khan Younis southern Gaza Strip.
